audio	sentence	duration	gender	native_lang
32_10370_0_321_01_220123-135049_bem_b8a_elicit_0.wav	abaume bane bali panse panshita ya kasuba bamo bali pamulu elyo bambi bali panshi 	8.371	male	bem
32_10249_2_321_01_220120-032914_bem_b8a_elicit_1.wav	aba baume abakalamba babili abakwata inkanda iya buuta bali mu muulu umo na paapa umunankwe mu numa cilemoneka ifyo bafuma mu ndeke 	13.771	male	bem
18_8007_0_181_01_211108-113245_bem_eda_elicit_0.wav	imbwa shibili shileingila paka panga shilebutuka 	5.2860000000000005	male	bem
11_6351_2_111_01_211030-091410_bem_1e5_elicit_1.wav	ee nimumona ali pali tukutuku uwaba nga motoka yaisuka pamuulu kabili uwamawilo yane ayakalamba 	8.552999999999999	female	bem
18_12126_4_181_01_211114-173214_bem_5da_elicit_2.wav	cine cine nomba apa cilemoneka kwati balafumyamo indalama ishingi saana pantu ifi fintu fyamutengo 	7.736000000000001	male	toi
1_157_4_11_01_211031-132632_bem_cc3_elicit_2.wav	amenshi tayasala inga taishiba ikusamba kunwin 	4.855	male	toi
36_5657_4_361_01_211115-100503_bem_654_elicit_2.wav	cacine ico shitata alemoneka mukote pantu nepala lyalisebeka 	7.191	male	bem
32_4456_0_321_01_211111-154404_bem_e94_elicit_0.wav	akamulumendo akaice kale owa mumumana 	3.312	female	nyj
28_9315_1_282_02_220103-162745_bem_9ff_elicit_0.wav	elyo ku numa yabo kuli abaume na abanakashi abekele patupuna nalimo pakutushisha 	10.527	female	bem
752_0_01_211011-170705_bem_6b0_elicit_0.wav	umwana umulumendo nabutuluka kumenso 	4.696000000000001	male	bem
28_9355_2_281_01_220109-153142_bem_94f_elicit_1.wav	cile moneka kwati kuli ebo ale sosha elyo kuli efyo emishe kuminwe katwishi nifinshi 	7.327999999999999	male	ngo
26_3045_4_261_01_211109-094445_bem_dcc_elicit_2.wav	eee cishinka ico walanda 	3.198	male	bem
31_4238_2_311_01_211109-214759_bem_85e_elicit_1.wav	elo balemoneka nensansa saana pakusambilila efyo cibomba ci mashini 	4.468999999999999	male	bem
36_11375_3_362_02_220227-101714_bem_d0b_elicit_1.wav	elyo kabili umu ali muli notumaluba utunono utusuma utwamena panshi 	8.349	male	bem
36_5474_0_361_01_211113-140407_bem_654_elicit_0.wav	abantu batatu bali pancinga balecofa 	5.445	male	bem
27_9066_1_272_02_211113-121650_bem_b15_elicit_0.wav	mupanga ilebutuka umu muli inkuni ishingi sana 	5.195	female	leh
35_11136_2_351_01_220118-191856_bem_ba5_elicit_1.wav	kuli abantu abengi abaletamba umupila 	3.244	male	bem
7_5334_2_71_01_211104-051956_bem_1e5_elicit_1.wav	akasuba nako nakabalika saana 	6.602	female	bem
31_10116_3_312_02_220131-150609_bem_c25_elicit_1.wav	bushe uyu namaayo no mwana wakwe umwaume elyo ne mbwa yabo ni finshi baleciita muli uyu umumana 	13.045	male	bem
19_7197_3_192_02_220118-211642_bem_5bb_elicit_1.wav	kuntashi kuli na icinga iyafita 	4.763999999999999	male	bem
4_4701_4_41_01_211031-104738_bem_5a5_elicit_2.wav	kunuma ya bantu aba kuli ifmuti nemyotoka ishikulu neshinono isha pusana pusana 	7.146	male	bem
16_7748_4_161_01_211110-102831_bem_74d_elicit_2.wav	ee kwena kuti caba cacine ico wasosa awe kanshi kufwile kuli ifilecitika uko balelolesha 	8.937999999999999	female	toi
25_2798_2_251_01_211109-192156_bem_5da_elicit_1.wav	cipalile kwati bashitata beshile fye muku pwishako inshita 	4.9910000000000005	male	toi
21_1813_0_211_01_211112-120650_bem_83a_elicit_0.wav	umwana umukashana umusungu naiminina pa ntashi yaci solobelo ico babikapo icakukopelako ifikope kabili alemona mulya balolesha nga baleipekanya ukukopa icikope calinga 	11.706	female	
14_7019_3_142_02_211111-100658_bem_5da_elicit_1.wav	kwena abafyashi wabo ninshi tabacibasendela mwituka mwine baciya 	5.15	male	toi
401_0_01_211016-115448_bem_9d4_elicit_0.wav	abalumendo nabakashana bali mumuputule emo bapiminamo imiti 	9.029	female	bem
32_4501_1_322_02_211111-070143_bem_947_elicit_0.wav	bushe finshi aba abantu bane balecita kuli iyi inchende iyatalala 	7.803999999999999	male	toi
19_1406_3_192_02_211110-165901_bem_d8d_elicit_1.wav	ama pepala aya yakatapa katapa namayo umo alesekelela ilyo ekete ipepala limo 	7.94	female	leh
12_6570_4_121_01_211105-120658_bem_9ed_elicit_2.wav	nabafwala icintu kumutwe kubacingilila beicena kumutwe 	5.853	male	nya
1_212_0_11_01_211031-161330_bem_cc3_elicit_0.wav	umwaume na umwanakashi nabeminina panse yetuuka 	7.463999999999999	male	toi
7_1609_3_72_02_211031-111918_bem_40e_elicit_1.wav	ubusanshi buli ubwabuta neca kucingilila ba mungwingwi nacena cintu cabuta 	7.282	female	bem
22_2059_3_222_02_211109-114509_bem_004_elicit_1.wav	kuli umwanakashi umo bashala ba lumendo 	3.335	female	nbl
13_3054_4_131_01_211107-023604_bem_8cc_elicit_2.wav	fifwila fyakubika kundobo ifilya isabi 	4.923	female	bem
34_5042_4_341_01_211113-192624_bem_004_elicit_2.wav	cipalile kwati mu cikuulwa mwalipita umusebo pakati 	4.015	female	nbl
22_7760_0_221_01_211112-114530_bem_004_elicit_0.wav	umulumendo ale moneka kwati ali mukupona paka pulanga kama wilo 	5.013	female	nbl
2_484_3_22_02_211026-201419_bem_2a5_elicit_1.wav	mucikuulwa icilemoneka nga ishitolo lya fyakufwala muli ifilubi ifyo bafwika ifya kufwala 	9.029	male	
9_2224_3_92_02_211027-053302_bem_901_elicit_1.wav	kunuma yaba caice babili abakulupo kuli amashitolo 	7.6	female	bem
38_6066_1_382_02_211112-204434_bem_f12_elicit_0.wav	alebomfya amalangi ayalekanalekana ayabomfeshiwa pamo na amenshi 	5.739	female	bem
21_1756_2_211_01_211112-100545_bem_83a_elicit_1.wav	kalemoneka akachenjela nalimo nakeshiba kuntu baleya nalimo ni filya fye imbwa shatemwa ukutungulula 	7.213999999999999	female	
17_7836_2_171_01_211109-111717_bem_947_elicit_1.wav	nasumina pantu iyi insula iyafita eyo imbwa isumine 	6.76	male	toi
22_7704_2_221_01_211112-074054_bem_004_elicit_1.wav	peeshati yakwe pali pumi ya kwa barack obama 	3.607	female	nbl
28_9239_2_281_01_220108-164726_bem_94f_elicit_1.wav	cilemoneka kwati ni mucungulo pantu takulafita saana 	5.921	male	ngo
1_3955_3_12_02_211104-144328_bem_2a5_elicit_1.wav	petebulo iyili pantanshi iya umwaume pali imbale ikwete ifyakulya neci botolo camenshi 	9.415	male	bem
22_7928_0_221_01_211113-010411_bem_004_elicit_0.wav	umwanakashi aleyangala 	3.017	female	nbl
33_4809_3_332_02_211109-221753_bem_b14_elicit_1.wav	kunuma kuli fensi iiputwile icibansa kabili nakwiminina abalumendo abateya amangalo kabili bafwele ifyakufwala ifya fitilila ifya kuteyelamo 	13.907	female	nse
7_5379_1_72_02_170101-073044_bem_74d_elicit_0.wav	elo incende alipo uyu umukashana pali abantu abengi 	6.67	female	toi
18_12141_4_181_01_211114-231002_bem_5da_elicit_2.wav	cine cine awe kanshi inama shakulaikalafye umwabuta tashakalelolelafye umweshi 	6.76	male	toi
13_6886_2_131_01_211031-095742_bem_9ed_elicit_1.wav	cileemoneka ta ceenda paantu amalubaba yaliambo kumena kuntanshi iya ici motoka 	7.146	male	nya
17_6586_4_171_01_220112-211234_bem_9fd_elicit_2.wav	cilemoneka kwati lelo eshile fye mwakwangala na ukusekesha abantu 	7.577000000000001	female	bem
28_9340_0_281_01_220109-144321_bem_94f_elicit_0.wav	indeke ile pupuka mumulu elyo panshi pali imyotoka ishile moneka kwati tashile enda 	7.962999999999999	male	ngo
29_3829_4_291_01_211114-123934_bem_433_elicit_2.wav	ee boi cishinka ico kanshi ubwalwa bufwaika ukunwakofye panono nga ulesansamuka ukucila nganaufulwa 	11.842	male	bem
32_4645_4_321_01_211112-182551_bem_e94_elicit_2.wav	pamulu yakwa shitata nanamayo napapita icimuti 	5.082	female	nya
36_11338_3_362_02_220227-074252_bem_d0b_elicit_1.wav	elyo kabili ifyo bawishi nomwana balelolesha abana bambi cili kwati nalimo balebasambilisha ifyakucita fimo pantu balefwala nokutoloka 	10.095	male	bem
13_6800_0_131_01_211028-143114_bem_9ed_elicit_0.wav	imbwa ile butuka mu cani ile moneka ili mu mpanga 	5.399	male	nya
10_6003_3_102_02_211101-103022_bem_ddd_elicit_1.wav	balemoneka tabale sela bale loleshanya noku lanshanya 	6.329	male	bem
16_7572_2_161_01_170101-091306_bem_74d_elicit_1.wav	fifwile fikulu saana ifyo aletotokanya uyu umulumendo 	7.213999999999999	female	toi
25_2810_4_251_01_211109-211400_bem_5da_elicit_2.wav	cilemoneka iyi enchende eko amabumba ayapusana yakumanina noku pekanya 	6.42	male	toi
24_2501_3_242_02_211108-185915_bem_150_elicit_1.wav	akasuba kali mukuwa pantu kulemoneka ukwafitilila 	5.331	female	bem
29_9485_3_292_02_220111-141547_bem_94f_elicit_1.wav	ku fikulwa bali kambatika ifikope cifwile mwaba amatuuka mukati 	8.076	male	ngo
33_4852_1_332_02_211110-112836_bem_b14_elicit_0.wav	aba abaume nabafwala itoloshi ilya fita ne nsapato ishafita elo ne cakufwala ca kumulu ica butilila 	10.821	female	nse
33_4874_0_331_01_211110-192004_bem_c25_elicit_0.wav	abacaice babili baleenda musebo kabili nabaifimba ku mitwe 	8.008	female	nse
27_8999_2_271_01_211113-110248_bem_f07_elicit_1.wav	elyo cilepala kwati uyu mulumendo alishiba saana inchito yakwe ukumona efyo ekatile icakutulilako icibumba 	11.366	male	nya
31_4410_3_312_02_211110-224809_bem_83a_elicit_1.wav	cine nalimo tatemenwe ati bamukope ninshi alelya 	4.083	female	
27_9124_0_271_01_211113-211654_bem_f07_elicit_0.wav	akaice kamwaume nakeminina elyo kaleyangasha ama toy 	4.763999999999999	male	nya
14_7227_0_141_01_211112-140321_bem_f08_elicit_0.wav	abana abakashana baleshana muncende umuli namalaiti ayapusana pusana 	9.324	female	bem
27_3320_2_271_01_211110-183457_bem_0cc_elicit_1.wav	cishinka efyo balemoneka aba bantu balemoneka tabakwete pakwikala nangula ma refugee 	8.439	female	leh
17_7991_2_171_01_211110-104643_bem_947_elicit_1.wav	balemoneka kwati nubskakopa bafikope 	5.2860000000000005	male	toi
2_4039_2_21_01_211031-101155_bem_2a5_elicit_1.wav	kunuma yakwe kuli ibumba ya bantu abali kunuma ifwele ifyakufwala ifyabuta na ifya kashika 	9.506	male	bem
26_3023_3_262_02_211109-123022_bem_8f1_elicit_1.wav	eee bafwile abantu bakuncende iyi pali efyo balesefya nangu pali efyo bali noku sefya muyanshiku echo bakakile utupepala kuntambo 	10.277	male	bem
32_4682_0_321_01_211112-225423_bem_e94_elicit_0.wav	umulumendo na umukashana babili bale enda kumbali yamusebo 	4.265	female	nya
34_5085_2_341_01_211114-101826_bem_50c_elicit_1.wav	mukashiba amenshi yamakumbi makumbi 	3.448	male	lam
22_7842_0_221_01_211112-191153_bem_004_elicit_0.wav	ibumba lya balumendo ile yangala mupila 	2.654	female	nbl
18_12034_0_181_01_211114-110309_bem_5da_elicit_0.wav	akamwaice kali panse kalelanda nomwaice munankwe uuli mu ng anda 	4.968	male	toi
25_2740_1_252_02_211109-154246_bem_f08_elicit_0.wav	icikotikala cine ici eco abomfya ukusendelapo ifipe fyabantu mumisebo 	7.305	female	bem
17_6594_1_172_02_220112-142814_bem_5da_elicit_0.wav	cilemoneka kwati pali ebo alelada nabo abali apatali nomba teti aleya ekobali pantu balicingilila 	7.917000000000001	male	toi
7_1659_2_71_01_170101-204415_bem_74d_elicit_1.wav	elo balefwaya ukwamba ukuteya umupila wakumunwe uo beta ati umupila wamuseke 	7.441	female	toi
12_2862_2_121_01_211031-072519_bem_bd6_elicit_1.wav	naikwata no mupila mu kanwa 	5.376	male	lam
28_9401_0_281_01_220111-073034_bem_94f_elicit_0.wav	umwaice umwaume ali mumenshi ale angala 	4.038	male	ngo
34_10817_4_341_01_220122-171820_bem_57f_elicit_2.wav	cipalile kwati pali ifyo aba bashikulu bantu balefwaya ukusambilisha aba bana balumendo kunuma yabana balumendo kuli abanakashi abeminine 	12.024	female	bem
27_9040_3_272_02_211113-071313_bem_e72_elicit_1.wav	kutiyaba pantu nokuboko kwamulumendo nakupita kunuma yakuboko kwamu kashana 	7.486000000000001	female	leh
13_6928_2_131_01_211031-141430_bem_9ed_elicit_1.wav	ku last ya lunkoto kule moneka ifi muti ifintu ifikulu 	5.966	male	nya
10_2318_4_101_01_211028-071454_bem_ddd_elicit_2.wav	mukumona kwandi uyu mwana nalya naikuta eco eminine aleteula imbale 	12.183	male	bem
17_7967_1_172_02_211111-094019_bem_e94_elicit_0.wav	bushe uyu mwana aikalilefye eeka mumenshi 	4.151	female	nya
32_4475_3_322_02_211110-184207_bem_947_elicit_1.wav	eee elo balemoneka kwati libumba ilyenda libilili libili mumpili 	9.664	male	toi
38_3_02_210926-164956_bem_81c_elicit_1.wav	bushe uyu shibantu atalwike kuli aba bambi bushe ali nabo aba abafwele ifyafituluka 	7.01	male	bem
17_7955_2_171_01_211110-080647_bem_947_elicit_1.wav	ee kabili cipalile intambo shamalaiti shipitile kumilando shibili 	8.394	male	toi
31_4426_0_311_01_211111-090317_bem_85e_elicit_0.wav	umwanakashi umusungu aleangasha indimu shibili isho aleposa muulu pa nshita shapusana 	5.4670000000000005	male	bem
26_3117_4_261_01_211109-204816_bem_dcc_elicit_2.wav	nshimwenepo namotoka katwishi nga shipitila kumusebo umbi 	5.513	male	bem
34_5108_0_341_01_211114-112524_bem_50c_elicit_0.wav	abalumendo babili bali pamutanto balewamya icikuulwa 	4.537	male	lam
495_2_01_210929-222455_bem_81c_elicit_1.wav	utu tuntu tuntu beta ati ama violin mucingeleshi twakulisishako inyimbo 	9.755	male	bem
37_5902_3_372_02_211112-094833_bem_aa2_elicit_1.wav	mumuputule mulemoneka muli ulukungu panshi 	3.924	female	bem
25_2838_0_251_01_211110-002901_bem_5da_elicit_0.wav	namayo alelandisha shitata uwulelongolola ifibokoshi mwi shitolo 	5.694	male	toi
15_7394_3_152_02_211030-144213_bem_8cc_elicit_1.wav	cilemoneka kwati balemutinya ukumwingisha umutwe pamenshi panshi 	7.622999999999999	female	bem
24_2592_1_242_02_211109-082907_bem_150_elicit_0.wav	umulumendo afwele ilaya lyafita alensankanya ifintu pa mbale yabeka 	5.581	female	bem
9_2238_1_92_02_211027-055633_bem_901_elicit_0.wav	ili mumuputule wa kwipikilamo 	2.79	female	bem
28_3664_3_282_02_211111-190702_bem_665_elicit_1.wav	pafisabo fili pa itebulo lyakwe ndemona ifinanazi pineapples kumbali ya cibokoshi cili pakati 	8.825	male	bem
34_5129_0_341_01_211114-133859_bem_50c_elicit_0.wav	umulumendo naiminina aletamba imbwa 	3.085	male	lam
35_5217_2_351_01_220114-170616_bem_ba5_elicit_1.wav	alemoneka kwati acilatoloka cilya icimuti ici mukashila nalimo ni nshila iyakwangalilamo 	7.055	male	bem
17_7927_1_172_02_211110-210844_bem_e94_elicit_0.wav	cilemoneka kwati umulumendo ali kumangalo kabili ali na mucibansa ca mangalo 	7.622999999999999	female	nya
7_5383_3_72_02_170101-073645_bem_74d_elicit_1.wav	elo uyu alesamba amoneka kwati tafwele nangufimo 	5.195	female	toi
16_6231_1_162_02_220104-200103_bem_15f_elicit_0.wav	bushe aba abalumendo bali pacikocikala pali efyo beshile mukushita mwituka ili 	7.691	female	bem
14_7007_3_142_02_211111-094410_bem_5da_elicit_1.wav	awe kwena baifunde bwino saana pantu bakabolala batupesha muno muncende 	5.739	male	toi
35_5435_1_352_02_220117-152507_bem_f12_elicit_0.wav	bushe ninshi imbwa shatemenwa ukwangala na utulubi 	4.468999999999999	female	bem
21_1833_3_212_02_211113-135533_bem_85e_elicit_1.wav	oo elo namwenekesha shitata uyu uusendele ifipe fyakwe nao alemoneka nalimo afibikile pali mpumpumpu wakwe mwamonapo shani 	9.415	male	bem
22_7759_0_221_01_211112-113719_bem_004_elicit_0.wav	shitata na baana bakwe baleenda musebo uwa pa maliketi 	5.535	female	nbl
17_6606_3_172_02_220112-151323_bem_5da_elicit_1.wav	awe kanshi naciwama nganshi cilemoneka farm yakaena yabela ku mpanga pantu kuli ifimuti ifingi sana 	9.301	male	toi
37_11603_1_372_02_211114-134938_bem_aa2_elicit_0.wav	kucisote kuli nesako ilikulu 	2.745	female	bem
12_2941_4_121_01_211031-185208_bem_bd6_elicit_2.wav	ehe kunuma ya cimpelwa kuli nefimuti 	6.965	male	lam
2_334_3_22_02_211026-123049_bem_2a5_elicit_1.wav	aka akabwa akanono kalelwisha ukupoka imbwa ici icidoli ico bonse basumine 	7.803999999999999	male	
25_2734_2_251_01_211109-121054_bem_5da_elicit_1.wav	cipalile kwati nabasendana bonse fye balupwa nefibusa 	4.7410000000000005	male	toi
22_7820_2_221_01_211112-164025_bem_004_elicit_1.wav	chilemoneka pali efyo alelanguluka shitata 	3.539	female	nbl
4_4596_0_41_01_211029-133115_bem_5a5_elicit_0.wav	abalumendo babili bali pama honda bale ensha mumusebo 	4.718999999999999	male	bem
12_2930_0_121_01_211031-170608_bem_bd6_elicit_0.wav	imbwa ilepepeka ifyoni 	5.7170000000000005	male	lam
28_9231_4_281_01_220108-153149_bem_94f_elicit_2.wav	cile moneka kwati efyo abanakashi ba fwala uku ku ncende 	5.172000000000001	male	ngo
20_7218_1_202_02_220119-013623_bem_665_elicit_0.wav	nabutukisha na icibe nacipuuka umubili onse efilelolesha umulumendo panchinga kunuma yakwe 	9.801	male	bem
13_6945_4_131_01_211031-144416_bem_9ed_elicit_2.wav	kule moneka uku bali abaice niku mushi mumi monekele iya ma yanda ayaba uku 	6.534	male	nya
27_3283_2_271_01_211110-162156_bem_0cc_elicit_1.wav	ifyola batulile panshi filemoneka baletushako apa bekele 	7.327999999999999	female	leh
22_2114_1_222_02_211109-182928_bem_004_elicit_0.wav	apa ekele nipamusebo 	3.017	female	nbl
38_11792_0_381_01_211114-151610_bem_ba5_elicit_0.wav	umwana umwanakashi uwabuuta inkanda aleangala mumenshi ayali mu kashima ako bembile mumucanga 	6.874	male	bem
33_10473_0_331_01_220128-171359_bem_b40_elicit_0.wav	abantu abalekanalekana apali abaume na banakashi aba mishinku iyalekanalekana kabili abali ne nkanda ishapusanapusana baali kuncende imo munshita yakasuba 	12.364	female	bem
12691_1_02_211103-143742_bem_a35_elicit_0.wav	tabakwata kumona fye ifyo bekala elo twingi icine cine balifimbako namantenti icakutila ne mfula nga yalishile teti balokwe 	9.46	male	bem
13_6949_0_131_01_211031-144934_bem_9ed_elicit_0.wav	motoka ili mumpanga ile pita pakati pa kamana 	4.763999999999999	male	nya
24_2686_2_241_01_211110-161307_bem_150_elicit_1.wav	elo bambi bamayo icampepo bafwele cintu ca kashika nelaya lya makumbi makumbi 	6.352	female	bem
33_4896_1_332_02_211110-140751_bem_b14_elicit_0.wav	umo umwaume wa nkanda ya buuta elyo umbi wankanda iya fita 	7.01	female	nse
33_4831_3_332_02_211109-233520_bem_b14_elicit_1.wav	pa ncende bali ni pa kati ya fikulwa ifitali sana elyo kuli ne fimuti na maluba 	8.712	female	nse
613_0_01_211005-111337_bem_dcc_elicit_0.wav	namayo naikala pamashini alepanga icakunyatapo panshi 	7.463999999999999	male	bem
13_3185_3_132_02_211025-154701_bem_9ed_elicit_1.wav	limbi ba ciikalisha sana mung anda apa epo ba ba lekelako kuba fyashi ati bangaleko 	8.53	male	nya
7_1661_4_71_01_170101-204916_bem_74d_elicit_2.wav	incende ilemonekafye kwati cisankano camukalale 	8.734	female	toi
36_5604_2_361_01_211114-200301_bem_654_elicit_1.wav	kabalwe natoloka icintu icabuta icamapulanga lili mumulu elyo pambali pali imipila shitatu ishabuuta 	11.071	male	bem
4_4560_4_41_01_211028-153019_bem_5a5_elicit_2.wav	aba babili eko bali kuli ifimuti kuli nefikulwa ifikulu ifilemoneka kwati ma sukulu nagula ifipatala 	12.115	male	bem
38_11865_3_382_02_211114-175144_bem_f12_elicit_1.wav	iciweme cakuti nafwala bwino bwino ifyakufwala ifyakumucingilila 	5.671	female	bem
8_5675_2_81_01_211102-095257_bem_ce8_elicit_1.wav	kaletoloka na ukutoloka 	4.061	male	bem
36_5679_0_361_01_211115-103433_bem_654_elicit_0.wav	umuntu umusungu ali kucende ukuli cinkupiti wabantu naimya nakapepala akanoono apalembelwe ifilembo 	8.757	male	bem
1_3966_0_11_01_211107-195133_bem_cee_elicit_0.wav	umuntu umo alepona ukufuma pamulu elyo umbi nao aletamba 	5.104	female	bem
18_12108_0_181_01_211114-163109_bem_5da_elicit_0.wav	umukashana naiminina nalolesha namumbali kunuma yakwe kuli abakashana babili abafwele ifyafita 	7.712999999999999	male	toi
12_2994_3_122_02_211106-101530_bem_e3a_elicit_1.wav	cilemoneka kwati nabatemwa saana ukumonana 	5.671	female	bem
12_2932_2_121_01_211031-171429_bem_bd6_elicit_1.wav	ehe elyo naba peta netoloshi 	6.76	male	lam
39_1192_3_392_02_211118-141100_bem_1e5_elicit_1.wav	bushe ukuli uyu umwana umunono uwiminine mupepi na cimashini cakuteyelako icangalo kuli finshi fimbi 	5.649	female	bem
37_5730_0_371_01_211110-125107_bem_5bb_elicit_0.wav	ibumba lyabantu ilikalamba nali tantama mumilongo 	6.715	male	bem
32_10435_2_321_01_220123-171515_bem_b8a_elicit_1.wav	uyu umumana ulemoneka uukalamba kabili uli ne langi ilya makumbimakumbi 	9.369	male	bem
12_6703_2_121_01_211106-222121_bem_9ed_elicit_1.wav	kunuma epo beminina kuli abantu abeminine 	5.376	male	nya
8_1895_4_81_01_211031-060841_bem_abe_elicit_2.wav	cilepala kuli ukucimfyanya 	3.198	male	bem
12538_3_02_211102-173543_bem_dcc_elicit_1.wav	ninjamona amalampi yakalamba elo bayabika apasansuka iyi incende ilemoneka nikululamba lyamumana efyo abantu bafulile icine cine nakalimo bacilasamba 	13.68	male	bem
13_3244_1_132_02_211025-222943_bem_9ed_elicit_0.wav	kunuma kwa shiko kuli mbwa ile moneka inchito yaiko yaku chingilila impanga nga kwaisa aba lwani 	10.595	male	nya
5_1225_4_51_01_211102-110951_bem_e3a_elicit_2.wav	kunuma yabo kuli icikulwa elyo panshi pali namaluba mu mpoto yamaluba 	6.465	female	bem
20_7440_2_201_01_220116-210324_bem_62a_elicit_1.wav	kwena ukuba umushilika kufwaika walikosa pantu teti ukwanishe ubwikalo bwabo 	7.6	female	bem
22_2071_1_222_02_211109-135739_bem_004_elicit_0.wav	honda ya makumbi makumbi elyo ikulu sana 	3.947	female	nbl
12_6617_0_121_01_211105-164927_bem_9ed_elicit_0.wav	imbwa shibili shileangala pamo pafyani 	4.242	male	nya
28_9366_1_282_02_220105-110335_bem_9ff_elicit_0.wav	apo ici cimbayambaya cikulu nalimo nacimakana pakuti aba bantu bakwelemo 	9.324	female	bem
1_3938_4_11_01_211107-074250_bem_cee_elicit_2.wav	umwana nafwala icamakumbimakumbi 	2.994	female	bem
12_6633_2_121_01_211105-181952_bem_9ed_elicit_1.wav	ututwine utujinga mwalanda twabaicefye 	5.7170000000000005	male	nya
14_3391_1_142_02_211030-095145_bem_743_elicit_0.wav	abantu abengi kumo nabalepita balepweneka bushe nimulandu nshi 	8.008	male	bem
21_7692_0_211_01_220118-134913_bem_665_elicit_0.wav	shikulubantu aleshitisha utupimfya twa tupepala kumusebo 	5.422000000000001	male	bem
30_4094_2_301_01_211110-111151_bem_654_elicit_1.wav	eya mune elyo akanya nakasendama 	6.261	male	bem
21_1773_2_211_01_211112-104036_bem_83a_elicit_1.wav	elyo naiminina napa chakumulefyako ico bapangila no ne shimbi pa kuti engafika apalepa apo icibumba capelela 	8.144	female	
36_5463_2_361_01_211113-132622_bem_654_elicit_1.wav	elyo nafwala ica mpeepo ica kaki icitali elyo na ishati lyabuta mukati 	9.301	male	bem
30_9823_1_302_02_220121-193655_bem_c25_elicit_0.wav	bushe ici icibansa aba abantu baliko cilemoneka shani mukati 	9.732	male	bem
33_4932_0_331_01_211110-235846_bem_c25_elicit_0.wav	umwanakashi umo uwa nkanda ya buuta ali pa njinga pakati ya musebo ku ncende ukuli ne mpanga 	12.818	female	nse
10_2467_2_101_01_211030-200700_bem_ddd_elicit_1.wav	shilemoneka kwati nalimo shabantu pantu ishamumpanga tashiba ifi 	8.008	male	bem
18_12088_0_181_01_211114-151021_bem_5da_elicit_0.wav	banyina nabawishi bali nabana batatu mubwato pamumana nabafwala nefyakuicingilako umo ngaponena pa menshi 	8.439	male	toi
2_473_0_21_01_211026-080138_bem_cee_elicit_0.wav	umulumendo nanina pali tukutuku aleensha kabili natoloka nayo mumuulu nalosha netayala lya kuntanshi 	9.506	female	bem
35_5422_1_352_02_220117-145204_bem_f12_elicit_0.wav	apa palemoneka lkwati ni pa ibala ilinono ilyo babyala mupepi na ing anda 	6.67	female	bem
13_3153_2_131_01_211108-070041_bem_8cc_elicit_1.wav	nifyo fine baleimbila abantu mu cikulwa emo bali bafwile encito babomba 	6.987	female	bem
34_5028_3_342_02_211113-234353_bem_50c_elicit_1.wav	mupepi yabo kuli incinga 	2.495	male	lam
22_7832_0_221_01_211112-172658_bem_004_elicit_0.wav	utukashana tubili tule samfya imbwa shabo 	3.221	female	nbl
14_7029_3_142_02_211111-102902_bem_5da_elicit_1.wav	awe kwena baleshisungilafye mung anda yabo pantu kuti shaipaya abantu bakayele 	5.694	male	toi
31_4359_3_312_02_211110-172432_bem_83a_elicit_1.wav	iyo nga aletina nga ali mukwima nomba nao nakalipa bonse nabalingana fye 	6.307	female	
18_12050_0_181_01_211114-120951_bem_5da_elicit_0.wav	akamukashana nakasekelela nakekala pamupila eo kabikile pamulu wafipuna ifyo bakulilila 	7.213999999999999	male	toi
10_2301_1_102_02_211106-063752_bem_574_elicit_0.wav	nafwala nama gilasi yafita bushe finshi alecita 	5.0360000000000005	female	bem
6_1316_2_61_01_211025-061826_bem_53e_elicit_1.wav	akakashana nakafwala ne toloshi ilya kashika elyo ne shati ilyafita nendyato kumolu 	14.52	male	bem
32_4510_4_321_01_211111-224630_bem_e94_elicit_2.wav	eee pancende iyi pali ama sitima yabili na ifimbaya mbaya 	6.443	female	nya
7_1745_0_71_01_170102-012538_bem_74d_elicit_0.wav	abantu babili bali muciswebebe nabafwala namalaya ayabuta 	6.352	female	toi
27_3231_1_272_02_211110-133959_bem_f07_elicit_0.wav	elo cipalile kwati uyu umulumedo alacita amangalo yama horse 	5.853	male	nya
34_5013_0_341_01_211113-175454_bem_004_elicit_0.wav	shitata na bana mayo batatu bali mwituka balepanga ifya kushitisha 	5.739	female	nbl
37_5903_2_371_01_211112-145022_bem_5bb_elicit_1.wav	incinga ilemoneka iyipya kabili bawishi bali abasekelela pamenso 	7.122999999999999	male	bem
28_3502_0_281_01_211112-085757_bem_d8d_elicit_0.wav	aka mwana aka kashana akabuta inkanda nakeminina mumbali yamusebo ilyo bakakopa icikope 	7.872000000000001	female	leh
37_11599_2_371_01_211114-065104_bem_5bb_elicit_1.wav	namayo nafwala nama galashi mumenso 	4.673	male	bem
21_1754_2_211_01_211112-100333_bem_83a_elicit_1.wav	nifyo fine nikulya abalecifyanyana basambila pantu amenshi yalemoneka aya makumbi makumbi elyo ni yalya babikako umuti yantu basunga 	10.209	female	
20_1635_0_201_01_211112-002313_bem_dbf_elicit_0.wav	abalumendo babili nabashikulubantu bamo nabafwala nefisote 	7.827000000000001	female	bem
33_4702_0_331_01_211109-120038_bem_c25_elicit_0.wav	abalumendo abafishi babili nabeminina ku ncende imo pa nshita ya bushiku 	8.666	female	nse
17_6552_3_172_02_220112-131500_bem_5da_elicit_1.wav	kunuma yakwe kuli nabalelisha ifilimba mukwai 	3.856	male	toi
30_9817_3_302_02_220121-184829_bem_c25_elicit_1.wav	bushe ni finshi uyu umwaume alecita muli uyu umuputule 	9.506	male	bem
6_1329_4_61_01_211025-064738_bem_53e_elicit_2.wav	elyo ifimuti ifili kumuna cipalile fyalikwata amabula ayakulu ukumwenafye kumisambo shili kumpela 	17.265	male	bem
327_0_01_211015-234919_bem_9d4_elicit_0.wav	umlumendo ali pa lupili aletoloka 	5.308	female	bem
32_4688_0_321_01_211112-230725_bem_e94_elicit_0.wav	umulumendo umusungu nakwela pakangalo akamataila 	4.673	female	nya
4_4678_4_41_01_211031-020325_bem_5a5_elicit_2.wav	uyu umulumendo uulifye eka alensha honda emangalo angala aya ayakwensha 	7.26	male	bem
15_7485_3_152_02_211030-181417_bem_8cc_elicit_1.wav	finshi abakashana balecita pa cisebele 	5.082	female	bem
