audio	sentence	duration	gender	native_lang
16_7693_2_161_01_211109-135343_bem_74d_elicit_1.wav	ee cacine elo kunuma yakwe kulemoneka ifikulwa ifyabuta elo ifikalamba 	8.099	female	toi
22_7718_3_222_02_211111-221336_bem_50c_elicit_1.wav	pa mumana pali ubulalo 	2.767	male	lam
17_7846_1_172_02_211109-204421_bem_e94_elicit_0.wav	cipalile kwati aba abana belelepula amapepa pa lunkoto 	5.535	female	nya
36_5576_3_362_02_211114-141651_bem_dbf_elicit_1.wav	mumuputule mwikele shitata icibumba cikwete ilangi lya butulukila 	8.371	female	bem
7_5403_2_71_01_211104-205551_bem_1e5_elicit_1.wav	mumpanga mwine umu nabeminika nemyotoka 	5.263	female	bem
1_180_0_11_01_211031-142957_bem_cc3_elicit_0.wav	umulumendo nanina pacipabi cakukunkulukapo 	8.734	male	toi
4_4715_3_42_02_211031-164003_bem_5a5_elicit_1.wav	uyu shitata nafwala ne toloshi it s fiita nensapato isha butuloluka 	6.76	male	bem
19_1295_3_192_02_211110-073548_bem_d8d_elicit_1.wav	elyo kunuma yakwa shitata kuli namayo afwele ica buta cilepala kwati eshile mukushita isabi 	8.167	female	leh
1_58_4_11_01_211030-102259_bem_cc3_elicit_2.wav	abasefya mumangalo ni abo abalonga utwingi mwisumbo aya apatali emulandu wine alechinga amunankwe mukutoloka pakulonga 	14.769	male	toi
14_3449_3_142_02_211030-133015_bem_743_elicit_1.wav	bonse balemoneka abasangalala bushe nifinshi fimbi efyo balecita 	6.488	male	bem
22_7888_1_222_02_211112-205244_bem_50c_elicit_0.wav	nde tontokanya bali ne nsala saana 	3.289	male	lam
20_7244_2_201_01_220116-175009_bem_62a_elicit_1.wav	kabili kunuma yaba temwikwa aba kuli abantu babili namayo na shitata bonse aba buta inkanda 	7.986000000000001	female	bem
15_7275_1_152_02_211029-164835_bem_8cc_elicit_0.wav	nafwala na icakufwala icipi ku maboko icakashikila mu fipeya 	9.347	female	bem
16_7652_4_161_01_211109-140650_bem_74d_elicit_2.wav	kafwile pali abale ka mona aka akamwana 	8.008	female	toi
33_4705_4_331_01_211109-120711_bem_c25_elicit_2.wav	emulandu wine abengi belile mu kuitamba pantu bambi nabalufya abatemwikwa babo mu busanso 	12.092	female	nse
25_2817_0_251_01_211109-222124_bem_5da_elicit_0.wav	shikulu bantu alenona icibombelo kuli ci machine 	4.015	male	toi
26_3149_4_261_01_211110-114131_bem_dcc_elicit_2.wav	elo futi abana balomfwa bwino sana ukwangalila mumenshi 	4.945	male	bem
27_8964_2_271_01_211113-102007_bem_f07_elicit_1.wav	balemoneka abacuula limbi baletontokanya pa mikalile yabo 	6.034	male	nya
20_1573_1_202_02_211112-210843_bem_654_elicit_0.wav	elyo ememine kufyo babumba fibili ifikalamba 	6.624	male	bem
16_7511_2_161_01_170101-054754_bem_74d_elicit_1.wav	awe mune tebushiku ubu kachili kasuba taulemona icinshingwa lwamwana cilemoneka 	10.277	female	toi
13_6926_3_132_02_211105-135203_bem_ce8_elicit_1.wav	kule moneka neci kulwa ici kalamba kunuma ya fimiti 	7.553999999999999	male	bem
32_4583_0_321_01_211113-012124_bem_e94_elicit_0.wav	umwana umusungu umunono naiminina elo nakwata icakwangasha kukanwa 	6.647	female	nya
13_3047_3_132_02_211024-114958_bem_9ed_elicit_1.wav	nga nabaluba imbwa kuti yabafwa ukusanga eko baleya 	5.626	male	nya
27_9035_2_271_01_211113-132203_bem_f07_elicit_1.wav	cilepala kwati aba bashikulu balelolela motoka 	4.605	male	nya
28_9284_4_281_01_220108-200142_bem_94f_elicit_2.wav	cifwile naishalila kunuma ishinankwe shili ku ntanshi 	4.968	male	ngo
15_3690_0_151_01_211027-135851_bem_8cc_elicit_0.wav	abana babili na bashikulu bantu lubali bali mupepi na amenshi 	10.481	female	bem
17_6694_1_172_02_220112-183728_bem_5da_elicit_0.wav	bushe apa bali nipa ng anda nangula baliku lodge 	3.766	male	toi
12239_3_02_211021-170152_bem_142_elicit_1.wav	nimbona fye cilepala kwati nakalimo nacimupapusha ifyo uyu mulumendo emine ukutoloka pali ici cikulwa kabili napeshiwa amano icine cine 	13.431	male	bem
34_5156_0_341_01_211114-150344_bem_50c_elicit_0.wav	umukashana na iminina mu musebo 	2.926	male	lam
17_7827_2_171_01_211109-094618_bem_947_elicit_1.wav	uku ukuntu kulemone kwali icila cakusefya 	6.965	male	toi
28_3606_0_281_01_211112-192919_bem_d8d_elicit_0.wav	bakepika wafyakulya bali mu cikini nabafwala nefyakufwala ifya buta 	6.579	female	leh
27_9124_1_272_02_211113-160323_bem_b15_elicit_0.wav	kali nensansa ukwangala nama toy umu kaleangalila nimu ncende yakwangalamo 	7.849	female	leh
34_5189_1_342_02_211114-152911_bem_004_elicit_0.wav	akanya akalumendo ka le enda keka 	2.767	female	nbl
14_3483_4_141_01_211105-221551_bem_ebf_elicit_2.wav	kumpili ishingi kwaba ukwatalala eico bonse nabafwala ama soko 	7.667999999999999	female	bem
18_11992_4_181_01_211113-190431_bem_5da_elicit_2.wav	ee boi abanakashi baseka ukwipika utwakulya utunono balafilwa ukukwanisha ifingi 	7.305	male	toi
32_4617_0_321_01_211112-170748_bem_e94_elicit_0.wav	umuntu umo ale angala mumumana ekafye 	3.312	female	nyj
2_4186_4_21_01_211102-101110_bem_2a5_elicit_2.wav	cilemoneka kwati akasuba nakabala saana icakuti nakubuuta saana na amakumbi nayalengama 	8.349	male	bmb
30_9818_3_302_02_220121-184959_bem_c25_elicit_1.wav	bushe ni finshi uyu mwanakashi uufwele akashati akabula amaboko alecita 	11.343	male	bem
5_4768_3_52_02_220107-220513_bem_574_elicit_1.wav	cine walikashika icine cine uyu mushipi imbwa ikwete mumukoshi kabili naupita napa cifuba yambwa 	7.781000000000001	female	bem
16_6409_3_162_02_220110-110105_bem_9fd_elicit_1.wav	bushe mwana wakwa shitata uyu 	4.174	female	bem
31_4232_3_312_02_211110-100943_bem_83a_elicit_1.wav	bakwete ba balloni 	1.6780000000000002	female	
9_5818_1_92_02_211028-024415_bem_ebf_elicit_0.wav	umo umulumendo nawa panshi elyo umbi nanina pa citukutuku 	8.825	female	bem
17_6484_4_171_01_220111-120014_bem_9fd_elicit_2.wav	kabili abikapo ne toloshi lyaku bombelamo ilya mito mito noku fita 	6.897	female	bem
32_4559_0_321_01_211113-002741_bem_e94_elicit_0.wav	abasungu babili bali mumusebo balebutuka 	3.766	female	nyj
13_6944_1_132_02_211105-142210_bem_ce8_elicit_0.wav	uwikele pa caakupeluka naci mwimya namumulu elyo na ikatisha nama boko yonse yabili kuti epona 	12.364	male	bem
25_2756_4_251_01_211109-152702_bem_5da_elicit_2.wav	emukwai aiminina pantu amona ukutila ati umutengo naucipa bwino 	6.397	male	toi
38_5975_1_382_02_211112-130238_bem_ba5_elicit_0.wav	ilyo abantu baleangala nangu ukucimfyanya muli ubu ubwangalo balaposa icimoneka nga umupila elyo balewisha utulemoneka nga amabotolo 	9.801	female	bem
26_2953_4_261_01_211108-141020_bem_dcc_elicit_2.wav	uyu umbi namayo ena nasekelela saana kuba lemukopa icikope 	5.7170000000000005	male	bem
17_6592_3_172_02_220112-142559_bem_5da_elicit_1.wav	bushe iyi encende bafumine mukwisula muncende iyi eko abantu besa mukupupwako umwela 	6.738	male	toi
29_9691_1_292_02_220114-214529_bem_84b_elicit_0.wav	babibile bale teya necangalo icaku bomfya amano 	4.174	male	ngo
27_3406_3_272_02_211111-151146_bem_f07_elicit_1.wav	elyo cilepala uyu mulumendo talefwaya kuti munankwe asende ibola kuli ena 	7.849	male	nya
14_7048_1_142_02_211111-111659_bem_5da_elicit_0.wav	bushe umu ekele emwi sitolo bafumine ukwisula umwakulila 	4.9	male	toi
15_3521_0_151_01_211022-100449_bem_8cc_elicit_0.wav	bana mayo aba myaka ishapusanapusana nabeminina nabesula na utunwa twabo 	6.375	female	bem
9_5981_1_92_02_211029-203510_bem_ebf_elicit_0.wav	bushe finshi uyu mulumendo ne mbwa balecita finshi 	4.218999999999999	female	bem
5_4780_2_51_01_220115-220558_bem_03f_elicit_1.wav	nabekata cipuna icafiita ica mawilo ico babomfya ukwenseshapo abakote nelyo abalwele 	11.661	female	bem
14_7250_1_142_02_211112-160932_bem_5da_elicit_0.wav	bushe kwena eba shitata balumbikwa mu calo conse aba abalwa saana 	4.628	male	toi
17_7967_2_171_01_211110-083119_bem_947_elicit_1.wav	awe uyu umwana nakalimo baleemusambika eco abelele mumenshi 	9.324	male	toi
34_10855_4_341_01_220128-163400_bem_d0b_elicit_2.wav	kuti chaba ati pakupona panshi uyu muntu achiba mulubilo pamulu wakwa kabalwe eloninshi taikakile bwino bwino 	8.462	male	bem
25_2853_0_251_01_211110-103530_bem_5da_elicit_0.wav	umukashana ufwele akapimpinya naikala napa njinga 	4.582	male	toi
22_7803_2_221_01_211112-154532_bem_004_elicit_1.wav	naikata naka kupantilako umupila kumaboko 	4.015	female	nbl
19_1258_3_192_02_211110-065930_bem_d8d_elicit_1.wav	elyo kabili kunuma yabo kuli ifimuti ifyauma 	4.513999999999999	female	leh
1_37_1_12_02_211026-095237_bem_d90_elicit_0.wav	bushe mangalo nshi aibimbilemo 	4.424	male	bem
13_6845_2_131_01_211029-212727_bem_9ed_elicit_1.wav	bafwile beshile muku samba mufi menshi bekala mupepi na umumana uyu 	5.966	male	nya
28_3684_1_282_02_211111-201811_bem_665_elicit_0.wav	naikata mumatumba napapa na akacola kunuma mupepi nankwe kuli icimbaya mbaya ca mito 	7.736000000000001	male	bem
2_390_1_22_02_211026-160351_bem_2a5_elicit_0.wav	umo natolokela pa musana wa munankwe elyo umo nakontamako pa kuti atoloke bwino 	6.965	male	
20_7255_0_201_01_220116-180155_bem_62a_elicit_0.wav	bashitata babili ababuta inkanda balelwa ulubuli lwa makofi nefi baka kick boxing 	6.897	female	bem
22_7948_2_221_01_211113-013139_bem_004_elicit_1.wav	umu na ikata umusalu wa lini 	2.949	female	nbl
13_6951_2_131_01_211031-150514_bem_9ed_elicit_1.wav	panshi bali yanshikapo ne cintu icua buta 	3.993	male	nya
11_6310_2_111_01_211029-104502_bem_1e5_elicit_1.wav	lyena umwanakashi umbi naikata pulasitiki apalembwa ifilembo 	8.008	female	bem
9_2177_2_91_01_211025-151934_bem_ebf_elicit_1.wav	kunuma yakwe kuli imbao iitali saana 	6.942	female	bem
13_6873_4_131_01_211031-083939_bem_9ed_elicit_2.wav	kuleemoneka kwati nikuumpanga uku taku pita nabaantu sana 	5.172000000000001	male	nya
17_7860_3_172_02_211110-024611_bem_e94_elicit_1.wav	ndemona kwati aya amangalo mangalo yaku cimfyanya 	4.537	female	nya
33_4722_1_332_02_211109-134239_bem_b14_elicit_0.wav	kabili uyu umulumendo nafwala icimpompo caku muchingilila ku mutwe 	7.417999999999999	female	nse
7_5264_2_71_01_211103-095731_bem_1e5_elicit_1.wav	pantanshi pali na umwanakashi uleenda nasenda nakacola akelamo ifyamwana 	11.774	female	bem
21_1936_0_211_01_211113-001327_bem_83a_elicit_0.wav	umulumendo umo ali muulu panuma yakutoloka ukubomfya akakushelemukilako mu menshi makasa 	7.101	female	
5_4807_4_51_01_220116-093510_bem_03f_elicit_2.wav	nabekata umwana ufwele ifya mutuntula kabili nabamwiminika pa matanta yabo 	8.326	female	bem
581_0_01_211004-130910_bem_81c_elicit_0.wav	bashitata babili abafwele ifyakashika nabeminina nashitata uufwele ifyafiita 	8.212	male	bem
27_9046_3_272_02_211113-072756_bem_e72_elicit_1.wav	aweh aba tabaleloba isabi balifye pamo bwato ukushunguluka 	5.694	female	leh
18_6794_4_181_01_220116-213453_bem_524_elicit_2.wav	aba abantu bonse mwibuumba nabalolesha kulya lubali eico ifinso fyabo tafilemoneka iyo 	7.191	female	bem
27_3236_4_271_01_211110-094256_bem_e72_elicit_2.wav	aba batata tabali apatali namayanda kunuma yabo kuli motoka iyabuta 	6.851	female	leh
19_1269_3_192_02_211110-071827_bem_d8d_elicit_1.wav	kumbali yamukashana utu akwete kamela kuli umukashana wamishishi ishabuta 	6.284	female	leh
31_4223_3_312_02_211110-103711_bem_83a_elicit_1.wav	cacine cilaanguka ukusanga umunabo nga aluba pantu nabafwala utwakubamwena apatali kukuichingilila 	6.216	female	
2_4121_1_22_02_211026-185751_bem_cee_elicit_0.wav	imbwa iloseshe umutwe kuncende ya ng ombe elo ilemoneka kwati ilebosa ing ombe 	6.034	female	bem
19_1373_3_192_02_211110-155158_bem_d8d_elicit_1.wav	uyu shitata kwena ali shipa pantu amabimbi nayema kunuma yakwe uko kwati yalamusenda 	7.441	female	leh
34_5140_0_341_01_211114-141337_bem_50c_elicit_0.wav	akamwanashi nakeminina neci muntu icakubumba ne mfula ya bungabunga 	4.832	male	lam
34_5111_0_341_01_211114-114159_bem_50c_elicit_0.wav	shitata nolupwa lwakwe bali pabulendo 	3.085	male	lam
32_4683_3_322_02_211112-102127_bem_947_elicit_1.wav	ukulingana nefyo balemoneka eehe nasumina balekopesha icikope 	9.823	male	toi
36_11442_0_361_01_220201-074458_bem_57f_elicit_0.wav	ummwaume uufwele shati lyamaboko ayatali naikata necisoselo naiminina pacisebele 	5.445	female	bem
6_5046_0_61_01_211028-073004_bem_976_elicit_0.wav	abantu cine lubali nabema amabaka ilyo batolweke mukufwaya ukuponena pamumana 	10.776	male	bem
450_2_01_211016-134717_bem_dcc_elicit_1.wav	alemoneka uyu shitata wacikoci pantu nakwata inkashi pa menso 	8.462	male	bem
2_309_3_22_02_211026-055640_bem_2a5_elicit_1.wav	kuli imyotoka ishikepita kumbali ukupelele ifyani kabili kulibna icikulwa icikalamba 	8.122	male	
33_4801_3_332_02_211109-214530_bem_b14_elicit_1.wav	elyo umbi nao alelisha ifisolobelo fya nyimbo ifingi elo nakwata ne cisoselo ico aleimbilamo 	10.118	female	nse
758_1_02_211011-172145_bem_81c_elicit_0.wav	masha yashani aya baleshana ayakwimya amaboko mumuulu na moolu 	6.443	male	bem
250_1_02_211013-180901_bem_9d4_elicit_0.wav	akabwa kakaena kalemoneka nalimo kalefwaya ukwikata kabola akakashika akali mumuulu 	10.935	female	bem
22_2058_4_221_01_211110-074750_bem_50c_elicit_2.wav	ku mulu naku beka elo kuli ukwa bundama 	5.49	male	lam
28_3620_4_281_01_211112-194739_bem_d8d_elicit_2.wav	aba abalumendo bonse balikwata imishishi ishipi ishafitulukila 	5.308	female	leh
22_2026_1_222_02_211108-224201_bem_004_elicit_0.wav	bali paku nina ama motoka bonse 	3.539	female	nbl
31_4277_0_311_01_211110-085730_bem_85e_elicit_0.wav	imbwa shibili shilecena panse pamulu ya meenshi makasa 	3.448	male	bem
11_6459_1_112_02_211031-080005_bem_1e5_elicit_0.wav	ni finshi alecita pa lunkoto 	4.378	female	bem
10_6206_3_102_02_211102-134613_bem_ddd_elicit_1.wav	bushe finshi alecita uyu umwana umukashana apa ekele 	6.624	male	bem
32_4586_3_322_02_211111-092646_bem_947_elicit_1.wav	mangalo ayakucinfyanya nakamupila akanono 	5.581	male	toi
20_7411_0_201_01_220116-204212_bem_62a_elicit_0.wav	aka mwana akakashana kalebutuka mumusebo pakati kebala 	5.7170000000000005	female	bem
13_3002_3_132_02_211024-023251_bem_9ed_elicit_1.wav	caciine kunuma kwabo kulemonekafye impanga 	4.923	male	nya
32_4519_4_321_01_211111-231548_bem_e94_elicit_2.wav	bonse babili shitata na namayo nabafwala imashati iyabuuta ilyo balebomba 	6.602	female	nya
18_12163_4_181_01_211115-094356_bem_5da_elicit_2.wav	ee boi ndemona ecilengele nokutila akwate na icicetekelo cakwimbisha saana kaili ninshi aishiba ati abantu nabatemwa ifyo alecita 	10.141	male	toi
39_1195_3_392_02_211118-141518_bem_1e5_elicit_1.wav	bushe ishi mbwa ishile sonsombana pakwangala icifulo shiliko nikwisa kabili kulemoneka shani 	7.486000000000001	female	bem
22_7922_1_222_02_211112-224221_bem_50c_elicit_0.wav	aba niba shikulu 	2.064	male	lam
28_9429_4_281_01_220111-100041_bem_94f_elicit_2.wav	cifwile bengi elyo besa mukwangalila uku kwine ku ncende mu kunina impili 	7.667999999999999	male	ngo
21_1931_0_211_01_211113-000724_bem_83a_elicit_0.wav	namayo umo naininina ku mbali ya bemba ninshi akasuba kali mukuwa 	4.696000000000001	female	
13_3080_2_131_01_211107-065348_bem_8cc_elicit_1.wav	nangu limbi ileangala elyo kunuma kuli abemike injinga na icitukutuku 	10.005	female	bem
26_8812_4_261_01_211112-005313_bem_8f1_elicit_2.wav	eee kuti caba cishinka ifyo walanda 	3.267	male	bem
34_10742_4_341_01_220120-141928_bem_1e5_elicit_2.wav	kuli iyi incende kuli ifikopa ifyela elyo ne fimuti cilemoneka kwati nimucifulo ba sungila ifintu ifyalekanalekana 	14.746	female	bmb
12_2759_2_121_01_211025-083856_bem_bd6_elicit_1.wav	saana fye elo kunuma yakwe kuli ibuumba ya abantu no lupili 	7.553999999999999	male	lam
7_1671_4_71_01_170101-211459_bem_74d_elicit_2.wav	elo aleumfwa nabwino ukubelenga ici citabo ilyashi lilimo naliwama 	8.961	female	toi
32_4658_3_322_02_211112-094505_bem_947_elicit_1.wav	bushe ninshi aba abalumendo bafwalile umusango kabili ninshi bale lisisha ing oma 	9.551	male	toi
38_11783_2_381_01_211114-123926_bem_ba5_elicit_1.wav	bonse bali mukati mwa cikuulwa cimo bushe cikuulwa ca musangonshi ici 	6.375	male	bem
21_1866_2_211_01_211112-223205_bem_83a_elicit_1.wav	cine mwasosa aba bantu iyi mishanine ilemoneka yaliseka ku ncende bekalila 	6.284	female	
17_7809_0_171_01_211109-073507_bem_947_elicit_0.wav	akamukashana akanono akamusungu nakekala mu ng anda keka 	8.394	male	toi
6_1389_0_61_01_211027-063354_bem_53e_elicit_0.wav	abantu bane baleteya ubwangalo bwamupila wakumakasa umo ena ali mucipanda emo eminine 	15.314	male	bem
10_6085_0_101_01_211104-130251_bem_5a5_elicit_0.wav	abaume bamo abanjinga bali mumulu na injinga 	5.082	male	bem
28_9410_0_281_01_220111-092427_bem_94f_elicit_0.wav	umulumendo natoloka mumulu aleikata akantu aka papatala notuma taila 	7.146	male	ngo
27_9020_0_271_01_211113-125624_bem_f07_elicit_0.wav	mulumendo umwaice nayiminina mumbali yacibumba 	4.218999999999999	male	nya
7_1594_2_71_01_170101-034444_bem_74d_elicit_1.wav	awe kanshi alishiba ukutolosha pantu ifi fyalyafya 	7.213999999999999	female	toi
7_5393_4_71_01_211104-142733_bem_1e5_elicit_2.wav	mucibansa mulifye amaloba elyo bashilamo nefyabuta 	8.666	female	bem
28_9373_0_281_01_220110-181259_bem_94f_elicit_0.wav	abaice babili abaume bale angasha imicanga ku lubemba 	4.197	male	ngo
22_7876_1_222_02_211112-202219_bem_50c_elicit_0.wav	ku lubali yabo kuli imyotoka shibili 	4.106	male	lam
31_4337_2_311_01_211110-144038_bem_85e_elicit_1.wav	cine abantu abalemoneka munshila nabapala ukuba abana besukulu yamasambililo yapa muulu elo uyu umulumendo pakubeya ukwa ku kulyo nakobeka akacola akaku sendelamo icaku kopelako utukope 	13.703	male	bem
11_6276_2_111_01_211028-041519_bem_1e5_elicit_1.wav	kabili iyi imbwa naifumya nolulimi ilyo ile enda 	6.443	female	bem
5_1150_2_51_01_211102-074556_bem_e3a_elicit_1.wav	mucimana umu muli namabwe ayakulu 	4.401	female	bem
28_3667_0_281_01_211112-211610_bem_d8d_elicit_0.wav	bashitata babuta inkanda babili nabafimba ubulangeti bwabuta umo nafwafwa na magalashi yaku mwafwa ukumona 	7.191	female	leh
28_9213_0_281_01_220107-182839_bem_94f_elicit_0.wav	abanakashi babili bali mu shitolo naba fimbilikisha imishishi shabo ne chisalu 	7.486000000000001	male	ngo
1_83_4_11_01_211030-105757_bem_cc3_elicit_2.wav	chakufwala icho ichile chingilila ukutila elamfya ifyakufwala ifili pamubili 	8.53	male	toi
22_2112_2_221_01_211110-150409_bem_50c_elicit_1.wav	umbi umulumnedo naiminina aletambe umunankwe 	4.628	male	lam
24_2509_2_241_01_211110-090146_bem_150_elicit_1.wav	kunuma ukwamulumendo uleimba kubelele umulumendo ulelisha ngo ma 	5.694	female	bem
52_1_02_210927-143219_bem_81c_elicit_0.wav	ngo yo umbi shikulu bantu uulemwikata kunsapato bushe finshi alecita 	5.785	male	bem
13_6811_2_131_01_211028-175621_bem_9ed_elicit_1.wav	umbi umwanakashi ufweele icafita ale bataamb a 	5.218	male	nya
10_2350_2_101_01_211028-231423_bem_ddd_elicit_1.wav	panshi pali napabomba nga apalokele imfula 	4.7410000000000005	male	bem
1_3911_0_11_01_211106-211346_bem_cee_elicit_0.wav	umwana umulumendo uwachaiche nafwala ichisote ichakashika nga umulopa munshita iyabushiki alepanga ishila elyo alepatula ifyabuta 	9.732	female	bem
21_1856_2_211_01_211112-221516_bem_83a_elicit_1.wav	kabili ku numa yakwa shitata kuli icipuna cama makumbi makumbi apali namabotolo ya mwangashi 	6.239	female	
13_6876_0_131_01_211031-093403_bem_9ed_elicit_0.wav	imbwa shibili ishitali nashiiminina pami caanga 	4.197	male	nya
25_2735_4_251_01_211109-121256_bem_5da_elicit_2.wav	ilitempele lilemoneka ilikulu sana mu musumba uyu elo nacho icimbayambaya chisuma sana 	7.962999999999999	male	toi
14_7107_0_141_01_211111-140554_bem_f08_elicit_0.wav	umwana umulumendo nafwala akasote nama gilasi ayafita nafwala nefyakufwala ifyakusambilamo mu swimming pool 	18.036	female	bem
19_1391_0_191_01_211109-121553_bem_665_elicit_0.wav	shitata wankanda yabuta ali pamulu we lyenshi naiminina pali surfing board namaboko mumulu 	8.439	male	bem
13_3238_3_132_02_211025-221206_bem_9ed_elicit_1.wav	nacibeela ici balee bomfya abaice 	4.197	male	nya
19_6957_2_191_01_220117-164521_bem_524_elicit_1.wav	umulu ulemoneka uwakashika kumula du wamalihiti yantu bashishe 	7.622999999999999	female	bem
21_1861_4_211_01_211112-222346_bem_83a_elicit_2.wav	kabili apo eminine palemoneka apasasuka nalimo epo atendekela ukwendela elyo akukulukila kuntu alefwaya ukuya 	9.415	female	
6_5117_4_61_01_211028-120221_bem_976_elicit_2.wav	icibi ica pamulungo wacikulwa cilemoneka cama kalashi ayakulu elyo abantu aba babili kuti baba abatemwikwa kumulandu nafintu bekele 	15.563	male	bem
12210_4_01_211021-142436_bem_dcc_elicit_2.wav	aba bashitata bonse babili apo balilemana cilemoneka kwati tabakumanisha ukuyendela abene emulandu wine balebonfesha utu ututukutuku 	13.272	male	bem
6_5150_3_62_02_211031-064741_bem_53e_elicit_1.wav	pa mumana palemoneka utumabimbi utunono utuleyima kumulandu wamukuku uuli pali bemba 	13.657	male	bem
29_9595_1_292_02_220113-192603_bem_84b_elicit_0.wav	kunuma yambwa kule moneka ibumba ilya baume ne ntambo iyaku kakilako imbwa 	7.396	male	ngo
32_4570_2_321_01_211113-005821_bem_e94_elicit_1.wav	kwati aba abantu niba kakwela bampili kumonafye nabakwata nenkonto isho bale shintilamo 	8.258	female	nya
7_5425_1_72_02_170101-041906_bem_74d_elicit_0.wav	nafwala na ifyakowelamo ifya makumbi makumbi 	5.7620000000000005	female	toi
27_3405_2_271_01_211111-165448_bem_6f4_elicit_1.wav	elo aka ka bola tekambwa iyo shitolelefye ishi 	4.492	female	leh
22_7733_3_222_02_211111-231025_bem_50c_elicit_1.wav	pa cimbi kuli akana kashika 	3.947	male	lam
22_2011_2_221_01_211109-162200_bem_50c_elicit_1.wav	akabwa kale butukila ukwingila mung anda 	4.151	male	lam
4_821_3_42_02_211024-172136_bem_5a5_elicit_1.wav	uyu shikulu bantu ali nanakulu bantu umo eo aleangala nankwe 	6.602	male	bem
21_1809_2_211_01_211112-115915_bem_83a_elicit_1.wav	cine balemoneka aba buchibusa pantu balelisisha ifilimba kabili nabafwala ifyakufwala fyama langi yapusana pusana 	7.917000000000001	female	
38_11789_3_382_02_211114-152221_bem_f12_elicit_1.wav	iyi ni nshita iya kumaca ilyo amatuuka tayalaisuka 	4.968	female	bem
13_6932_4_131_01_211031-142132_bem_9ed_elicit_2.wav	ale moneka tate mwene efyo bale mweba ba mayo 	4.129	male	nya
13_3086_3_132_02_211024-172750_bem_9ed_elicit_1.wav	endita nababika nakakopo epo balipisha umuntu ulionse uulefwaya kuti aposamo akapiya eko talefwaya ukubomfya 	11.275	male	nya
5_1098_0_51_01_211101-223610_bem_e3a_elicit_0.wav	umwaume alemoneka uwansansa saana 	4.174	female	bem
33_4790_4_331_01_211109-190143_bem_c25_elicit_2.wav	amayanda ayalemoneka ku numa yali mu fensi 	7.417999999999999	female	nse
28_9208_4_281_01_220107-182115_bem_94f_elicit_2.wav	limbi shikulu bantu uyu emwine wacikulwa ici 	5.15	male	ngo
22_7870_2_221_01_211112-202242_bem_004_elicit_1.wav	cilemoneka kwati umukashana ale fwaya uku shita 	3.584	female	nbl
39_1060_4_391_01_211118-211420_bem_901_elicit_2.wav	kulemoneka ukusuma kabili ukukuso kwakwe kuli ifikulwa fyantunti ifitali elyo mumbali yaifi fikulwa muli amacinga yabili ayo beminike 	11.23	female	bem
5_1149_2_51_01_211102-074451_bem_e3a_elicit_1.wav	balemoneka ngabaleshimikilapo imbila iimo 	4.242	female	bem
2_4195_4_21_01_211102-102449_bem_2a5_elicit_2.wav	iilele panshi intu yafiita icipesha mano ku masakofye yonse kabili kuli kali linga ne cishimbi ku numa ya mbwa 	11.774	male	bmb
20_7301_1_202_02_220119-180637_bem_665_elicit_0.wav	mupepi pepi na icikulwa ca metro icamakalashi 	4.9910000000000005	male	bem
1_130_1_12_02_211027-091619_bem_d90_elicit_0.wav	bushe ni finshi alecita 	2.518	male	bem
33_4862_0_331_01_211110-183450_bem_c25_elicit_0.wav	umwanakashi umo uwa nkanda iya buuta aleensha injinga pa musebo 	9.006	female	nse
6_1433_0_61_01_211027-095134_bem_53e_elicit_0.wav	umulumendo wabuuta inkanda tafwele neshati afwelefye akaputula aleyangala pa meenshi 	13.816	male	bem
7_1675_4_71_01_170101-212346_bem_74d_elicit_2.wav	ee awe kwena aba bantu limbi belefye mukutamba aka kamumana elo nafimbipo 	7.463999999999999	female	toi
25_2837_1_252_02_211109-212915_bem_f08_elicit_0.wav	tata mulensambilishako ukwensha icimbayambaya cenu nganakula mukampela umwana aleeba ba wishi bakwe 	9.778	female	bem
13_6942_4_131_01_211031-144027_bem_9ed_elicit_2.wav	ale moneka afi sendele mukwangu fyanya 	3.244	male	nya
13_6890_4_131_01_211031-101028_bem_9ed_elicit_2.wav	limbi beeshile muku shita imikate balelolelafye babaleetele 	5.331	male	nya
8_5502_1_82_02_211104-211204_bem_901_elicit_0.wav	uyu umwana mukashana 	7.305	female	bem
36_5684_2_361_01_211115-103922_bem_654_elicit_1.wav	eya mune ukumonafye ifyo ifimuti fiponeshe amabula cilepala kwati ninshita yalusuba 	9.369	male	bem
31_10112_4_311_01_220127-034446_bem_eb0_elicit_2.wav	uyu umwaume no mwana umwaume ulemoneka kwati mwana wakwe baleangala mu mucanga kabili balepanga ifyakupanga ukubomfya iloba 	14.724	female	bem
2_406_1_22_02_211026-162835_bem_2a5_elicit_0.wav	amulekela ukuti acofe elyo alekonkamo pa kuti umwana epona 	7.327999999999999	male	
5_1147_4_51_01_211102-074258_bem_e3a_elicit_2.wav	icishimbi ico imbwa iletoloka nacikwatamo ifyabuuta elyo nomutuntulu 	5.785	female	bem
1_3908_2_11_01_211106-210807_bem_cee_elicit_1.wav	akantu anininepo kalikwata amatayela yane 	4.492	female	bem
6_5037_3_62_02_211030-054222_bem_53e_elicit_1.wav	kuminwe shonse shibili nakemya inshimbi shakucishilako ifyakufwala elyo kaolola amaboko 	10.05	male	bem
4_4639_4_41_01_211031-003702_bem_5a5_elicit_2.wav	iyi incende ishi imbwa shibili ishilelwa nakwata na maluba ayasuma mumbali 	8.53	male	bem
19_7172_3_192_02_220118-204311_bem_5bb_elicit_1.wav	aba abantu bale moneka bali mucitemwiko 	3.38	male	bem
38_11912_1_382_02_211114-190048_bem_f12_elicit_0.wav	iyi ine incende ilemoneka kwati baipangila ukangalilako 	4.265	female	bem
31_9956_4_311_01_220128-144026_bem_c25_elicit_2.wav	kunuma ya uyu umwaume umukoloci kuli namayo uwamushinku wapakati uwabuuta inkanda no mushishi uwipi uwafita 	15.336	male	bem
12_2767_1_122_02_211105-205547_bem_e3a_elicit_0.wav	umwana alemoneka uwansansa 	6.806	female	bem
37_11489_4_371_01_211113-122123_bem_5bb_elicit_2.wav	elyo panse yabwendo pali umucanga uwingi 	4.628	male	bem
27_9091_1_272_02_211113-131218_bem_b15_elicit_0.wav	uyu mwana uwiminine mwanakashi pamulu yamabwe ekete pali icimuti 	7.191	female	leh
33_4946_1_332_02_211110-205330_bem_b14_elicit_0.wav	abaume babili nabeketa utushimbi utwakubomfya ukuteyelako 	6.556	female	nse
