audio	sentence
/scratch/skscla001/speech/data/bigcgen/audio/28_9371_3_282_02_220105-110828_bem_9ff_elicit_1.wav	shonse shibili nabashifwika na intambo mu mukoshi 
/scratch/skscla001/speech/data/bigcgen/audio/33_4737_2_331_01_211109-135353_bem_c25_elicit_1.wav	kabili mu muputule umu muli ama kompyuta ayengi pa ma tebulo 
/scratch/skscla001/speech/data/bigcgen/audio/1_3955_3_12_02_211104-144328_bem_2a5_elicit_1.wav	petebulo iyili pantanshi iya umwaume pali imbale ikwete ifyakulya neci botolo camenshi 
/scratch/skscla001/speech/data/bigcgen/audio/9_5898_4_91_01_211030-114824_bem_901_elicit_2.wav	kwena cipalile kwati acitemwa nomba akumanya ubusanso pantu pamenso napalanga ukuti tacenekela ukukumanya ici cimuti cilambalele 
/scratch/skscla001/speech/data/bigcgen/audio/7_5489_4_71_01_211105-153044_bem_1e5_elicit_2.wav	elo imbwa iyi naikwata nentambo mumukoshi 
/scratch/skscla001/speech/data/bigcgen/audio/19_1420_3_192_02_211110-171121_bem_d8d_elicit_1.wav	naba fwala nama koti yapancito yabo ayakatapa katapa yabutulukila 
/scratch/skscla001/speech/data/bigcgen/audio/27_9055_3_272_02_211113-115618_bem_b15_elicit_1.wav	nomba iyi imbwa yalipusanako saana nefimoneka imbwa shimbi naipalako ka donkey 
/scratch/skscla001/speech/data/bigcgen/audio/37_11693_3_372_02_211114-172515_bem_524_elicit_1.wav	kabili pali na icilemoka kwati nincinga nomba cikwete amawilo yabili kunuma 
/scratch/skscla001/speech/data/bigcgen/audio/24_2557_1_242_02_211109-071253_bem_150_elicit_0.wav	kunuma yakwe kuli umulumendo ufwele afyafita 
/scratch/skscla001/speech/data/bigcgen/audio/467_2_01_211016-141256_bem_dcc_elicit_1.wav	elyo akamwana kaleumfwa bwino pantu nakasekelela 
/scratch/skscla001/speech/data/bigcgen/audio/16_7681_2_161_01_211109-151149_bem_74d_elicit_1.wav	elo uyu umulumendo aleimya aya amabula yauma mumulu 
/scratch/skscla001/speech/data/bigcgen/audio/14_3378_1_142_02_211030-004840_bem_743_elicit_0.wav	ilyo shilebutuka bushe epo shili palemoneka shani 
/scratch/skscla001/speech/data/bigcgen/audio/28_3482_3_282_02_211110-183634_bem_665_elicit_1.wav	ala uyu shitata nao mwe bushe lupemba lwabuta lulwa asubile kumenso 
/scratch/skscla001/speech/data/bigcgen/audio/1_11_4_11_01_211028-234636_bem_cc3_elicit_2.wav	balemoneka bali ku cikuulwa cabwalwa elyo abaume nabaishinga ifyakashika kumulomo 
/scratch/skscla001/speech/data/bigcgen/audio/7_1721_2_71_01_170102-004346_bem_74d_elicit_1.wav	bushe kuti watila ileangala iyi imbwa 
/scratch/skscla001/speech/data/bigcgen/audio/15_7367_3_152_02_211030-134645_bem_8cc_elicit_1.wav	nalimo epakuti alimbe bwino pakufika panshi 
/scratch/skscla001/speech/data/bigcgen/audio/33_10497_4_331_01_220129-043105_bem_b40_elicit_2.wav	aba abacaice baleyangalila pamo ukwabula ubwafya cipalile kwati baleyangala icangalo ica kupika ne mfuti mu fintu 
/scratch/skscla001/speech/data/bigcgen/audio/34_5184_1_342_02_211114-152137_bem_004_elicit_0.wav	banyina nabekala nomwana umukashana 
/scratch/skscla001/speech/data/bigcgen/audio/22_2071_1_222_02_211109-135739_bem_004_elicit_0.wav	honda ya makumbi makumbi elyo ikulu sana 
/scratch/skscla001/speech/data/bigcgen/audio/1_51_4_11_01_211030-100327_bem_cc3_elicit_2.wav	nafwala ichimpompo ichakuchingilila kumutwe nga aponena panabwe nentambo ipitile mumusana yakumwika inga alefwaya ukupona 
/scratch/skscla001/speech/data/bigcgen/audio/8_5726_2_81_01_211102-112659_bem_ce8_elicit_1.wav	kabili nakobeka ne cakukopelako mu mukoshi 
/scratch/skscla001/speech/data/bigcgen/audio/22_7936_0_221_01_211113-011535_bem_004_elicit_0.wav	ibumba lya bantu ile sambilila panse 
/scratch/skscla001/speech/data/bigcgen/audio/19_6957_2_191_01_220117-164521_bem_524_elicit_1.wav	umulu ulemoneka uwakashika kumula du wamalihiti yantu bashishe 
/scratch/skscla001/speech/data/bigcgen/audio/8_1779_3_82_02_211026-065650_bem_ce8_elicit_1.wav	nabafutatila uko abanabo bonse baloleshe 
/scratch/skscla001/speech/data/bigcgen/audio/32_4533_4_321_01_211112-000003_bem_e94_elicit_2.wav	na ifintu bashitata bashitile naba filonga mumufuko 
/scratch/skscla001/speech/data/bigcgen/audio/39_920_0_391_01_211117-123007_bem_1e5_elicit_0.wav	mumuputule wakwikalamo muli bawishi abale angasha akanya kabo 
/scratch/skscla001/speech/data/bigcgen/audio/7_5296_3_72_02_211027-170112_bem_74d_elicit_1.wav	elo cipalile kwati amenshi tayengila mufyakufwala bafwele aba baana 
/scratch/skscla001/speech/data/bigcgen/audio/11_2606_3_112_02_211026-155623_bem_1e5_elicit_1.wav	beshile mukumumona ku ng anda 
/scratch/skscla001/speech/data/bigcgen/audio/2_4182_3_22_02_211026-213226_bem_cee_elicit_1.wav	kuliko icibwendo cimo ico babiika umo imbwa ilepita pa kusambilila 
/scratch/skscla001/speech/data/bigcgen/audio/18_6715_4_181_01_220116-124853_bem_524_elicit_2.wav	umo pali aba abalumendo babili euleensha ubwato 
/scratch/skscla001/speech/data/bigcgen/audio/16_6286_4_161_01_220110-190553_bem_5da_elicit_2.wav	cilemoneka kwati aba abana bali nabafyashi babo abekele katalamukila 
/scratch/skscla001/speech/data/bigcgen/audio/12_2794_0_121_01_211026-014955_bem_bd6_elicit_0.wav	akabwa kaletolauka 
/scratch/skscla001/speech/data/bigcgen/audio/16_7739_0_161_01_211110-101415_bem_74d_elicit_0.wav	ibumba lyabaume nabeminina elo umo alelanda 
/scratch/skscla001/speech/data/bigcgen/audio/38_11864_4_381_01_211114-170846_bem_ba5_elicit_2.wav	awe na ukuyafye mukowa filya nga nakukaba nga waya owako waitalalikako panono 
/scratch/skscla001/speech/data/bigcgen/audio/27_3412_4_271_01_211111-170800_bem_6f4_elicit_2.wav	chilepala kwati kuli eko alebutukila 
/scratch/skscla001/speech/data/bigcgen/audio/33_4877_4_331_01_211110-212447_bem_c25_elicit_2.wav	nakabili abalumendo babili abele endela kunuma nabafwala ifimambomba umo nakobeka ne chola 
/scratch/skscla001/speech/data/bigcgen/audio/28_9280_1_282_02_220102-152933_bem_9ff_elicit_0.wav	cilemoneka kwati bali mu muputule wa kwipikilamo ifya kulya 
/scratch/skscla001/speech/data/bigcgen/audio/31_4228_3_312_02_211110-100440_bem_83a_elicit_1.wav	balemoneka natemwa ukusambilila nangu line imikalile taili bwino 
/scratch/skscla001/speech/data/bigcgen/audio/28_9404_4_281_01_220111-091906_bem_94f_elicit_2.wav	cifwile ku toloka ututwine utumilundu pa kucimfyanya elo tule moneka kwati twakuipangila 
/scratch/skscla001/speech/data/bigcgen/audio/33_4807_1_332_02_211109-221318_bem_b14_elicit_0.wav	abantu bambi bale enda no kufuma elyo bambi baleingila mukati ka cikulwa 
/scratch/skscla001/speech/data/bigcgen/audio/21_7576_4_211_01_220117-191039_bem_665_elicit_2.wav	hahaha hahaha awe tekanya nkashi yandi naine ndesubila cipalile nga apakupangila chicken shawarma 
/scratch/skscla001/speech/data/bigcgen/audio/36_5636_0_361_01_211115-083552_bem_654_elicit_0.wav	umwaice umwaume naiminina pamusebo ubushiku naimya necipepala mumulu 
/scratch/skscla001/speech/data/bigcgen/audio/34_10774_0_341_01_220121-060357_bem_1e5_elicit_0.wav	abantu abapusanapusa abengi bali mu cifulo cimo pali aba pali abaume na banakashi elyo na baice 
/scratch/skscla001/speech/data/bigcgen/audio/10_6056_1_102_02_211101-190714_bem_ddd_elicit_0.wav	imbwa yabuta naisenda akamupila aka katapakatapa kukanwa 
/scratch/skscla001/speech/data/bigcgen/audio/16_6337_0_161_01_220111-114053_bem_5da_elicit_0.wav	shitata ufwele ifya fita naiminina na namayo ufwele ilaya ilya buta 
/scratch/skscla001/speech/data/bigcgen/audio/487_4_01_211003-152114_bem_81c_elicit_2.wav	shitata muntu uulelokesha pamafunde yamupila ukukonka ati aba abaleteya baleyakonka 
/scratch/skscla001/speech/data/bigcgen/audio/10_6215_4_101_01_211108-095501_bem_5a5_elicit_2.wav	alemoneka kwati nalimo aleyangala notu nkunda 
/scratch/skscla001/speech/data/bigcgen/audio/27_3364_4_271_01_211111-125612_bem_e6d_elicit_2.wav	cipalile balefwaya uku pitamofye bamone ifyabamo ukusekesha amenso nama tontonkanyo 
/scratch/skscla001/speech/data/bigcgen/audio/22_2048_3_222_02_211109-113200_bem_004_elicit_1.wav	umwana nafwala ilaya na toloshi ya kashika noku fita 
/scratch/skscla001/speech/data/bigcgen/audio/12_2967_2_121_01_211101-024209_bem_bd6_elicit_1.wav	kuli na baume abalelisha ing oma 
/scratch/skscla001/speech/data/bigcgen/audio/22_2069_4_221_01_211110-084131_bem_50c_elicit_2.wav	utupepala twalikashika utuli panshi tule langa umwapita umusebo 
/scratch/skscla001/speech/data/bigcgen/audio/12_2767_1_122_02_211105-205547_bem_e3a_elicit_0.wav	umwana alemoneka uwansansa 
/scratch/skscla001/speech/data/bigcgen/audio/35_5318_1_352_02_220114-163228_bem_f12_elicit_0.wav	uku bali kulemoneka icani elyo na ifimuti ifya lelema 
/scratch/skscla001/speech/data/bigcgen/audio/7_5350_3_72_02_170101-060907_bem_74d_elicit_1.wav	elo aleteya akamupila akanono aka makumbi makumbi 
/scratch/skscla001/speech/data/bigcgen/audio/17_6541_3_172_02_220112-122850_bem_5da_elicit_1.wav	mumusebo balenda mulemoneka umwa busaka saana 
/scratch/skscla001/speech/data/bigcgen/audio/34_10807_3_342_02_220128-033124_bem_d0b_elicit_1.wav	icikulwa cili mupepi bushe finshi fimbi ifilemoneka pali iyi incende umwaume alipo 
/scratch/skscla001/speech/data/bigcgen/audio/13_3135_1_132_02_211024-212623_bem_9ed_elicit_0.wav	cilemoneka mwana uwesukulu pamo nabakafundisha bakwe 
/scratch/skscla001/speech/data/bigcgen/audio/27_9138_0_271_01_211113-213711_bem_f07_elicit_0.wav	bashitata nabekala pa benchi na plastic iyabuta epo bekele 
/scratch/skscla001/speech/data/bigcgen/audio/36_11353_2_361_01_220129-114336_bem_57f_elicit_1.wav	elyo kabili abengi nabafwalo busaka kabili nabafwala namakalashi lyena cipalile kwati balelanshanya fimo 
/scratch/skscla001/speech/data/bigcgen/audio/8_1766_3_82_02_211026-062146_bem_ce8_elicit_1.wav	lilangi nshi lya cakufwala afwele 
/scratch/skscla001/speech/data/bigcgen/audio/33_10579_1_332_02_220130-230013_bem_b40_elicit_0.wav	bushe aba banakashi imisepela babili abakwata inkanda iya buuta balemoneka shani 
/scratch/skscla001/speech/data/bigcgen/audio/27_3439_0_271_01_211111-201535_bem_e72_elicit_0.wav	imbwa ya fiita ileenda pamenshi yeka 
/scratch/skscla001/speech/data/bigcgen/audio/37_5777_1_372_02_211111-092807_bem_aa2_elicit_0.wav	bali icinkumbawile abalumendo nabakashana 
/scratch/skscla001/speech/data/bigcgen/audio/34_5162_4_341_01_211114-152010_bem_50c_elicit_2.wav	babili abalumendo naba biina kunuma ya motoka 
/scratch/skscla001/speech/data/bigcgen/audio/28_3637_1_282_02_211111-153531_bem_665_elicit_0.wav	kamo kukulyo kalelya apple elyo kamo nako kukuso kalelya ulukonde natwikala na mucipuna camu muputule wakutushishamo 
/scratch/skscla001/speech/data/bigcgen/audio/28_3660_3_282_02_211111-185134_bem_665_elicit_1.wav	nakwata na amashikiyo kukutwi alikwata na umushishi uutali umbi upitile na palinso 
/scratch/skscla001/speech/data/bigcgen/audio/33_4852_1_332_02_211110-112836_bem_b14_elicit_0.wav	aba abaume nabafwala itoloshi ilya fita ne nsapato ishafita elo ne cakufwala ca kumulu ica butilila 
/scratch/skscla001/speech/data/bigcgen/audio/32_4658_3_322_02_211112-094505_bem_947_elicit_1.wav	bushe ninshi aba abalumendo bafwalile umusango kabili ninshi bale lisisha ing oma 
/scratch/skscla001/speech/data/bigcgen/audio/36_5481_3_362_02_211113-122607_bem_dbf_elicit_1.wav	kumbali ya filimba filelisha umulumendo kuli netebulo nensalu ya bulauni pamulu pali na intambo 
/scratch/skscla001/speech/data/bigcgen/audio/239_4_01_210929-185755_bem_9d4_elicit_2.wav	nimbona natoloka ukufuma pa muulu elo kwati alefwaya ukwingisha umutwe pa mucanga 
/scratch/skscla001/speech/data/bigcgen/audio/16_7684_3_162_02_211110-174352_bem_eab_elicit_1.wav	kuti wakwanisha uku chita aya amangalo balechita aba abakashana 
/scratch/skscla001/speech/data/bigcgen/audio/34_5014_3_342_02_211113-215430_bem_50c_elicit_1.wav	umulumendo ali sunga nomushishi uutali 
/scratch/skscla001/speech/data/bigcgen/audio/34_4959_3_342_02_211113-160226_bem_50c_elicit_1.wav	cilemoneka kwati cidoli aleensha 
/scratch/skscla001/speech/data/bigcgen/audio/2_327_1_22_02_211026-122058_bem_2a5_elicit_0.wav	mwi tenti muli ifilimba ifi kalamba ifi tantikwe pa cisebele 
/scratch/skscla001/speech/data/bigcgen/audio/12560_4_01_211102-211430_bem_142_elicit_2.wav	cishinka sana uku kwine kwalifula sana ifimuti sana kuncende uku kaili balibyala nolunkoto ulusuma kaili ululemoneka bwino kaili nabeminika na motoka 
/scratch/skscla001/speech/data/bigcgen/audio/7_1732_4_71_01_170102-010656_bem_74d_elicit_2.wav	ukushicingilila imyona pakuti shiicena 
/scratch/skscla001/speech/data/bigcgen/audio/2_376_1_22_02_211026-154932_bem_2a5_elicit_0.wav	shile butuka mu menshi elo imo na ifumya na umucila 
/scratch/skscla001/speech/data/bigcgen/audio/20_7212_0_201_01_220115-214545_bem_62a_elicit_0.wav	shitata wabuta inkanda naikata icakulya kuminwe ilyo aleenda mumusebo 
/scratch/skscla001/speech/data/bigcgen/audio/183_3_02_210928-173025_bem_dcc_elicit_1.wav	cimbi abana bonse aba nabafwala ifya kufwala ifya fita 
/scratch/skscla001/speech/data/bigcgen/audio/35_11160_0_351_01_220118-193316_bem_ba5_elicit_0.wav	umulumendo umo naikala panshi na insale yakwe 
/scratch/skscla001/speech/data/bigcgen/audio/28_3510_4_281_01_211112-091021_bem_d8d_elicit_2.wav	eya imifwalile yabo yilemoneka iyapala nomba kwena nayipusana elyo ukupitilila kunse yacibansa kuli ibumba lya bantu abaletamba uyu mupila 
/scratch/skscla001/speech/data/bigcgen/audio/36_5508_3_362_02_211113-150346_bem_dbf_elicit_1.wav	imbwa ikwete ama langi yabili iya bulauni neyabuuta pakubutuka naifumya no lulimi 
/scratch/skscla001/speech/data/bigcgen/audio/22_7823_1_222_02_211112-112434_bem_50c_elicit_0.wav	nakwimina bashitata naba namamayo 
/scratch/skscla001/speech/data/bigcgen/audio/14_3391_1_142_02_211030-095145_bem_743_elicit_0.wav	abantu abengi kumo nabalepita balepweneka bushe nimulandu nshi 
/scratch/skscla001/speech/data/bigcgen/audio/27_9001_4_271_01_211113-122419_bem_f07_elicit_2.wav	eya mukwai pantu ishitima eyakwata ifimawilo nefishimbi fyafina saana 
/scratch/skscla001/speech/data/bigcgen/audio/27_3428_4_271_01_211111-194844_bem_e72_elicit_2.wav	cilemoneka kwati elyo baleyamukushita ama dilinki ya kokakola 
/scratch/skscla001/speech/data/bigcgen/audio/28_9397_0_281_01_220110-202507_bem_94f_elicit_0.wav	umukashana alelishe imbushi ifyakulya paminwe yakwe 
/scratch/skscla001/speech/data/bigcgen/audio/25_2940_2_251_01_211110-191945_bem_5da_elicit_1.wav	emukwai ba wishi ebamushitile ubushiku alesefya ubushiku afyelwe 
/scratch/skscla001/speech/data/bigcgen/audio/11_6256_1_112_02_211101-155624_bem_574_elicit_0.wav	uyu mwana nafwala ifyakufwala ifyakashika elyo nacisote cakashika 
/scratch/skscla001/speech/data/bigcgen/audio/31_10112_4_311_01_220127-034446_bem_eb0_elicit_2.wav	uyu umwaume no mwana umwaume ulemoneka kwati mwana wakwe baleangala mu mucanga kabili balepanga ifyakupanga ukubomfya iloba 
/scratch/skscla001/speech/data/bigcgen/audio/10_6135_2_101_01_211104-150648_bem_5a5_elicit_1.wav	taponene atolwekefye pantu aleyensha akantu 
/scratch/skscla001/speech/data/bigcgen/audio/14_7005_0_141_01_211111-080224_bem_f08_elicit_0.wav	umulumendo aleeshelela pa menshi nakali pulanga kamukamana 
/scratch/skscla001/speech/data/bigcgen/audio/32_4564_3_322_02_211111-085124_bem_947_elicit_1.wav	eee cacine nasumina kabili bekele na mukantelelwe 
/scratch/skscla001/speech/data/bigcgen/audio/19_7041_0_191_01_220118-084347_bem_524_elicit_0.wav	bashitata nabeminina baleshimika 
/scratch/skscla001/speech/data/bigcgen/audio/15_3695_1_152_02_211023-143632_bem_9ff_elicit_0.wav	elyo kabili nabekata na icimuti ku minwe yabo 
/scratch/skscla001/speech/data/bigcgen/audio/1_3781_0_11_01_211105-200622_bem_cee_elicit_0.wav	umulumendo ali mucikuulwa aleangala 
/scratch/skscla001/speech/data/bigcgen/audio/9_2154_3_92_02_211026-170053_bem_901_elicit_1.wav	ninshi ilelangilila ukuti beeni kuli iyi ncende 
/scratch/skscla001/speech/data/bigcgen/audio/30_9930_3_302_02_220121-183647_bem_eb0_elicit_1.wav	bushe uyu umwanakashi uwiminine no mwaume finshi alecita mu bwato 
/scratch/skscla001/speech/data/bigcgen/audio/15_3576_1_152_02_211022-114601_bem_9ff_elicit_0.wav	bushe finshi alecita apo eminine 
/scratch/skscla001/speech/data/bigcgen/audio/7_5430_1_72_02_170101-042655_bem_74d_elicit_0.wav	kuntu aleya kuli utumuti utwa katapa katapa 
/scratch/skscla001/speech/data/bigcgen/audio/13_6825_2_131_01_211029-171502_bem_9ed_elicit_1.wav	kunuma kule moneka akalimba akaanoono limbi eko bale fwaya uku bomfya pakuashana 
/scratch/skscla001/speech/data/bigcgen/audio/20_1566_3_202_02_211112-205802_bem_654_elicit_1.wav	kuli nabanamayo abaleciluka umusebo kuntanshi yakwe 
/scratch/skscla001/speech/data/bigcgen/audio/33_4771_4_331_01_211109-165146_bem_c25_elicit_2.wav	cilemoneka kwati nabakumana pamo mu kulanshanya 
/scratch/skscla001/speech/data/bigcgen/audio/19_7088_2_191_01_220118-131019_bem_524_elicit_1.wav	petebulo pantu alebombela pali ifintu ifya lekanalekana 
/scratch/skscla001/speech/data/bigcgen/audio/17_6509_3_172_02_220112-114628_bem_5da_elicit_1.wav	kabili shi tata uyu ale pyangila kuci pyango ca kashika 
/scratch/skscla001/speech/data/bigcgen/audio/13_6960_1_132_02_211105-211204_bem_ce8_elicit_0.wav	nakontama panshi elyo kumo ukuboko naikata napanshi pene kumbi ekete pamulu pacintu alimo 
/scratch/skscla001/speech/data/bigcgen/audio/36_11436_0_361_01_220201-073021_bem_57f_elicit_0.wav	ummwanakashi umukalamba ale enda pamusebo ukufuma mucikuulwa mupepi nankwe kabili nafwala na bomba yafiita 
/scratch/skscla001/speech/data/bigcgen/audio/33_4927_2_331_01_211110-234926_bem_c25_elicit_1.wav	umo umulumendo napapa ichola ica fitilila 
/scratch/skscla001/speech/data/bigcgen/audio/17_7844_1_172_02_211109-203619_bem_e94_elicit_0.wav	uyu umulumendo na umukashana balelanshanya 
/scratch/skscla001/speech/data/bigcgen/audio/28_9230_2_281_01_220108-144224_bem_94f_elicit_1.wav	aya amangalo ale cita kuti yaleta ubusanso sana ifi afwele fwaku lenga eichena sana nga apona panshi 
/scratch/skscla001/speech/data/bigcgen/audio/31_4377_1_312_02_211110-174958_bem_83a_elicit_0.wav	kuntu alepupukila kuntu kwayemba nganshi 
/scratch/skscla001/speech/data/bigcgen/audio/8_5741_1_82_02_211106-031154_bem_901_elicit_0.wav	uusendele umupila nabamwika ku mulumendo umbi 
/scratch/skscla001/speech/data/bigcgen/audio/22_7727_1_222_02_211111-223542_bem_50c_elicit_0.wav	ici tukutuku ca makumbi makumbi no kufita 
/scratch/skscla001/speech/data/bigcgen/audio/17_7951_1_172_02_211111-084456_bem_e94_elicit_0.wav	uyu umwana nafunga na makofi kuminwe 
/scratch/skscla001/speech/data/bigcgen/audio/22_7712_2_221_01_211112-074923_bem_004_elicit_1.wav	umulumendo aleeonka isaya ya kanya 
/scratch/skscla001/speech/data/bigcgen/audio/26_3020_3_262_02_211109-121725_bem_8f1_elicit_1.wav	balicita bwino uku pangilako ifipuna mumisebo pantu kwaliba shimo imisebo isha lepa sana elo pakuti ufike eko uleya awe ninshi naunaka saana kuti watala watushako munshili 
/scratch/skscla001/speech/data/bigcgen/audio/22_1982_0_221_01_211109-113941_bem_50c_elicit_0.wav	imbwa naibomba ilimumenshi 
/scratch/skscla001/speech/data/bigcgen/audio/28_9267_4_281_01_220108-184119_bem_94f_elicit_2.wav	efyo cile moneka limbi mukati muli abantu bambi 
/scratch/skscla001/speech/data/bigcgen/audio/2_4061_3_22_02_211026-114850_bem_cee_elicit_1.wav	icishiba ca koowelamao cili nama lembo panshi na mumbali yaciko kabili akasuba nakasanika lelo ilemoneka nishita yakasuba 
/scratch/skscla001/speech/data/bigcgen/audio/2_406_1_22_02_211026-162835_bem_2a5_elicit_0.wav	amulekela ukuti acofe elyo alekonkamo pa kuti umwana epona 
/scratch/skscla001/speech/data/bigcgen/audio/37_5756_0_371_01_211110-183707_bem_5bb_elicit_0.wav	bakacofa bama ciinga balecilikana 
/scratch/skscla001/speech/data/bigcgen/audio/17_7987_1_172_02_211111-102234_bem_e94_elicit_0.wav	umwana nabutuka na ulubilo mu cintelelwe 
/scratch/skscla001/speech/data/bigcgen/audio/38_11864_2_381_01_211114-170846_bem_ba5_elicit_1.wav	uyu mucanga uo umumana usenda elyo waisa utulika mu mbali nga ifi 
/scratch/skscla001/speech/data/bigcgen/audio/19_1203_1_192_02_211109-172001_bem_d8d_elicit_0.wav	bonse bali abankanda yabuta banamayo babili na bashitata babili 
/scratch/skscla001/speech/data/bigcgen/audio/7_5414_3_72_02_170101-040620_bem_74d_elicit_1.wav	elo apa ni pacibansa calunkoto lwa katapa katapa 
/scratch/skscla001/speech/data/bigcgen/audio/18_12054_0_181_01_211114-122144_bem_5da_elicit_0.wav	shitaata umo nanamayo wakwe baleyenda nabekatana napa kuboko kunuma yabo kuleisa nabanamayo babili baleshimika 
/scratch/skscla001/speech/data/bigcgen/audio/2_451_0_21_01_211026-072834_bem_cee_elicit_0.wav	ibumba lya bakashana baleteya umpila wa kumoolu uwa kucimfyanya 
/scratch/skscla001/speech/data/bigcgen/audio/27_9150_2_271_01_211113-215308_bem_f07_elicit_1.wav	ifi fyakufwala fyakwicingilila limbi wapona 
/scratch/skscla001/speech/data/bigcgen/audio/7_5286_3_72_02_211027-160341_bem_74d_elicit_1.wav	nomba imifwalile yakaena na akaputula kamukati kalemoneka pakutoloka 
/scratch/skscla001/speech/data/bigcgen/audio/17_7956_0_171_01_211110-080826_bem_947_elicit_0.wav	imbwa iyakashika ili palunkoto ileangala 
/scratch/skscla001/speech/data/bigcgen/audio/16_6240_3_162_02_220104-201314_bem_15f_elicit_1.wav	bushe kuli icikombe cakupela uwalawina ukucimfya uku 
/scratch/skscla001/speech/data/bigcgen/audio/32_10422_2_321_01_220123-163413_bem_b8a_elicit_1.wav	ici icifulo cipalile kwati citesheni uko baninina ishitima ilibomfya amalaiti 
/scratch/skscla001/speech/data/bigcgen/audio/19_1276_3_192_02_211110-072306_bem_d8d_elicit_1.wav	elyo pamushili pali umucanga uwingi sana 
/scratch/skscla001/speech/data/bigcgen/audio/33_10637_1_332_02_220202-123341_bem_b40_elicit_0.wav	bushe cilemoneka ukuti finshi nalimo fintu uyu umuntu uushishibikwe bwino bwino alecita muli ici cikulwa 
/scratch/skscla001/speech/data/bigcgen/audio/16_7680_4_161_01_211109-151046_bem_74d_elicit_2.wav	ee elo ulunkoto bemininepo kulemoneka ulwakatapa katapa 
/scratch/skscla001/speech/data/bigcgen/audio/4_4528_3_42_02_211030-134817_bem_5a5_elicit_1.wav	kaili bambi bali kwati balelya elo bambi bale tamba aba abaice elo baleyangalila 
/scratch/skscla001/speech/data/bigcgen/audio/34_5085_2_341_01_211114-101826_bem_50c_elicit_1.wav	mukashiba amenshi yamakumbi makumbi 
/scratch/skscla001/speech/data/bigcgen/audio/7_5269_0_71_01_211103-110542_bem_1e5_elicit_0.wav	umwaume afwele ishati ilya pepo alelolesha umwaume afwele ishati ilyafita 
/scratch/skscla001/speech/data/bigcgen/audio/22_1999_2_221_01_211109-154658_bem_50c_elicit_1.wav	aka lubi aka kabwa 
/scratch/skscla001/speech/data/bigcgen/audio/10_6195_1_102_02_211102-122234_bem_ddd_elicit_0.wav	abanakashi bamo bafwelefye kaputula iyakashika na icifungamabele 
/scratch/skscla001/speech/data/bigcgen/audio/18_12059_4_181_01_211114-123607_bem_5da_elicit_2.wav	cishinka ico boi elyo cilamuntu alebkmbela ukuti awine pantu uwawina balamupela indalama ishingi saana 
/scratch/skscla001/speech/data/bigcgen/audio/12762_4_01_211103-173858_bem_a35_elicit_2.wav	iyi incende muntu wandi baliwamya kabili icisebele fye ceka ceka ciletiinya ala mwandi nshatalamonapo incende necisebele ico bawamya umusango yu 
/scratch/skscla001/speech/data/bigcgen/audio/25_2817_0_251_01_211109-222124_bem_5da_elicit_0.wav	shikulu bantu alenona icibombelo kuli ci machine 
/scratch/skscla001/speech/data/bigcgen/audio/19_1342_2_191_01_211109-052006_bem_665_elicit_1.wav	kabikapo akatambala mumutwe amakalashi yafita kaputula wafituluka elyo na pata pata kunkasa 
/scratch/skscla001/speech/data/bigcgen/audio/22_7816_3_222_02_211112-110446_bem_50c_elicit_1.wav	nabamwiya kuli bakateiya banakwe 
/scratch/skscla001/speech/data/bigcgen/audio/32_4688_0_321_01_211112-230725_bem_e94_elicit_0.wav	umulumendo umusungu nakwela pakangalo akamataila 
/scratch/skscla001/speech/data/bigcgen/audio/34_5174_0_341_01_211114-161625_bem_50c_elicit_0.wav	umulumendo ale bomba mu nshishi 
/scratch/skscla001/speech/data/bigcgen/audio/34_10855_4_341_01_220128-163400_bem_d0b_elicit_2.wav	kuti chaba ati pakupona panshi uyu muntu achiba mulubilo pamulu wakwa kabalwe eloninshi taikakile bwino bwino 
/scratch/skscla001/speech/data/bigcgen/audio/27_3401_1_272_02_211111-150308_bem_f07_elicit_0.wav	bushe ifi filimwa filemoneka kwati fyanshi 
/scratch/skscla001/speech/data/bigcgen/audio/34_5108_0_341_01_211114-112524_bem_50c_elicit_0.wav	abalumendo babili bali pamutanto balewamya icikuulwa 
/scratch/skscla001/speech/data/bigcgen/audio/22_7872_2_221_01_211112-202518_bem_004_elicit_1.wav	na ibomba 
/scratch/skscla001/speech/data/bigcgen/audio/17_7917_4_171_01_211110-064130_bem_947_elicit_2.wav	ee kuti mwamonafye kuli nemipando ishya kwikalapo abatwele abaana pali na ifyola 
/scratch/skscla001/speech/data/bigcgen/audio/6_5188_3_62_02_211031-085429_bem_53e_elicit_1.wav	imbwa shonse shibili shili notusalu utwakakwa mu mukoshi utwakashika elyo imbi pantanshiko mu mukoshi na umushipi uwakakwamo 
/scratch/skscla001/speech/data/bigcgen/audio/34_4985_1_342_02_211113-175951_bem_50c_elicit_0.wav	abantu bambi nabekala pama matabo 
/scratch/skscla001/speech/data/bigcgen/audio/15_7452_0_151_01_211027-144809_bem_9ff_elicit_0.wav	umuntu ali na umupila wabulamo umwela mukati 
/scratch/skscla001/speech/data/bigcgen/audio/19_1385_1_192_02_211110-162725_bem_d8d_elicit_0.wav	namayo nafwala akasote nefyakufwala fyafita 
/scratch/skscla001/speech/data/bigcgen/audio/764_2_01_211012-143639_bem_6b0_elicit_1.wav	ifi fintu bafimbene nafyo kumenso fyakubacingilila ilyo balepunkana ukukanaicena ilyo balepunkana 
/scratch/skscla001/speech/data/bigcgen/audio/31_4250_4_311_01_211109-221744_bem_85e_elicit_2.wav	iyoo kwena nailembaula pa menso 
/scratch/skscla001/speech/data/bigcgen/audio/15_3574_4_151_01_211025-123205_bem_8cc_elicit_2.wav	kabili kuli na abantu bambi abaleenda elyo umbi kakwela pa ncinga 
/scratch/skscla001/speech/data/bigcgen/audio/37_11651_2_371_01_211114-134436_bem_5bb_elicit_1.wav	umwakulala muli na ukwakusamika umutwe 
/scratch/skscla001/speech/data/bigcgen/audio/22_7895_3_222_02_211112-210415_bem_50c_elicit_1.wav	cilemoneka kwati na ku talala kuli iyincende 
/scratch/skscla001/speech/data/bigcgen/audio/5_1129_0_51_01_211102-071730_bem_e3a_elicit_0.wav	imbwa shibili shilepepekana pameenshi 
